Number,Subject,Title,Article,ArticleXML,Created By,Created On,Description,Key Words,Modified By,Modified On,Status,BaseTemplate
AKB-01050,Service,Redressement de la patte de dérailleur,{6034f210-0978-4869-b8bc-1a04f7b14766},"<articledata><section id='0'><content>La patte de dérailleur est le dispositif pendu derrière la patte droite (fente d’essieu de la roue arrière dans le cadre) sur laquelle s’attache le dérailleur arrière. Sur certains vélos, elle fait partie du cadre. Sur la plupart des vélos haut de gamme, c’est une pièce métallique distincte, qui peut être remplacée en cas de dommage. </content></section></articledata>",First name Last name,21/01/2008,Redressement de la patte de dérailleur,patte de dérailleur,First name Last name,21/01/2008,Publié,Procédure
AKB-01031,Service,Ajustement des roulements de la roue avant,{619933e6-4de2-457e-802f-1d27ef45ddfb},"<articledata><section id='0'><content>Pour remettre en état les roulements, dévissez un contre-écrou et un cône de roulement de l’axe au-dessus d’un chiffon. Dans la plupart des moyeux, les roulements se détachent. Nettoyez tout le mieux possible, à l’aide d’un solvant ininflammable et non toxique pour les poumons. Examinez tout pour détecter l’usure, notamment les cônes de roulement, les cuvettes (surfaces intérieures du moyeu) et les billes de roulement. Les billes doivent être brillantes, pas ternes. Bien que ce soit rare, vérifiez quand même si le corps du moyeu n’est pas fendu ou craquelé, notamment sur les bords extérieurs des cuvettes. Mettez de la graisse neuve dans les cuvettes, plaquez les roulements dans la graisse, replacez les cônes et les contre-écrous sur l’axe et ajustez correctement. </content></section></articledata>",First name Last name,21/01/2008,Ajustement des roulements de la roue avant,"roulements, contre-écrou, cônes",First name Last name,21/01/2008,Publié,Procédure
AKB-01014,Composants,Informations de base sur le jeu de direction,{667b170f-3a6f-41e4-85bf-202c421532b2},"<articledata><section id='0'><content><![CDATA[Le jeu de direction est l’assemblage de roulements qui connecte la fourche avant au cadre.<BR>Il permet à la fourche de tourner pour la direction et l’équilibre. Le guidon doit tourner sans à-coups.]]></content></section><section id='1'><content><![CDATA[<P>Il existe des jeux de direction filetés ou non filetés.</P><P>Le jeu de direction fileté est constitué de roulements, de cuvettes, de cônes, de contre-écrous et de joints. Il s’adapte à une fourche au moyen d’un axe de direction fileté. Le jeu de direction non fileté est très comparable, mais il a une bague ajustable qui s'adapte sur un axe de direction non fileté.</P><P>Les roulements du jeu de direction doivent être maintenus ajustés pour éviter toute rotation déséquilibrée.</P><P>Il existe quatre bagues : la bague de couronne, la bague de roulement inférieure, la bague de roulement supérieure et la bague de hauteur.</P>]]></content></section></articledata>",First name Last name,21/01/2008,,"jeu de direction, diriger, axe de direction, équilibre, roulement, cuvette, cône, contre-écrou, joint",First name Last name,21/01/2008,Publié,Procédure
AKB-01013,Composants,Informations de base sur le cadre,{05e5e56d-ae6c-4f76-874c-2776bbee3b5e},"<articledata><section id='0'><content><![CDATA[Le cadre est le squelette du vélo. La partie avant du cadre comporte le tube de direction, le tube horizontal, le tube diagonal et le pédalier. La selle et la fourche y sont attachés. La partie arrière du cadre comporte le tube de selle, les bases de la fourche arrière et les haubans.]]></content></section><section id='1'><content><![CDATA[<P>Un jeu de cadre comporte le cadre et les fourches.</P><P>La taille du cadre se mesure en général à partir du centre du pédalier jusqu’au haut du tube de selle. L’unité de mesure est soit le pouce, soit le centimètre ; les vélos Adventure Works Cycle se mesurent en pouces.</P><P>Les cadres de vélos peuvent être en aluminium, titane ou acier. Chacun a des caractéristiques différentes telles que force, rigidité et poids, qui affectent la qualité de conduite. Le matériau dont est fait le cadre est moins important que le diamètre des tubes, la géométrie du cadre et l’épaisseur des parois des tubes.</P>]]></content></section></articledata>",First name Last name,21/01/2008,,"cadre, fourche, tube",First name Last name,21/01/2008,Publié,Procédure
AKB-01026,Vélos de tourisme,Manuel utilisateur des vélos de tourisme Adventure Works Cycle,{0135527b-8a19-4a60-81c0-290ddc2985b1},<articledata><section id='0'><content><![CDATA[Ce manuel concerne tous les modèles de vélos de tourisme :<BR>Tourisme-3000<BR>Tourisme-2000<BR>Tourisme-1000]]></content></section><section id='1'><content><![CDATA[<P>Table des matières</P><P>1. Les pièces d’un vélo</P><P>2. Géométrie et spécifications</P><P>3. Exécution d’un contrôle de sécurité </P><P>4. Entretien de votre vélo : Informations de base sur le réglage</P><BLOCKQUOTE dir=ltr style='MARGIN-RIGHT: 0px'><P>Retrait des roues avant et arrière<BR>Nettoyage et graissage</P></BLOCKQUOTE><P>5. Entretien de votre vélo : utilisateurs expérimentés</P><BLOCKQUOTE dir=ltr style='MARGIN-RIGHT: 0px'><P>Planning de maintenance<BR>Le système de freinage<BR>Vitesses et transmission<BR>Guidon et jeu de direction<BR>Suspension avant et arrière</P></BLOCKQUOTE><P>6. Revendeurs</P><P>7. Informations de garantie</P>]]></content></section></articledata>,First name Last name,21/01/2008,,"utilisateur, manuel, tourisme, vélo, pièce, géométrie, spécifications, maintenance, garantie",First name Last name,21/01/2008,Publié,Procédure
AKB-01046,Service,Réglage du dérailleur avant,{5c9df2b5-ea53-4d39-82e6-2a15b8d86f25},<articledata><section id='0'><content>Vérifiez que le collier du dérailleur est encore dans sa position d’origine et correctement aligné de telle sorte que le bord externe de la cage soit parallèle au grand plateau. Vérifiez la hauteur. Le bas du bord extérieur de la cage doit se trouver à 1 ou 2 mm au-dessus du grand plateau lorsque vous poussez le levier de vitesses pour amener la cage vers le haut. Le dérailleur doit être juste assez haut pour permettre de passer au grand plateau.</content></section></articledata>,First name Last name,21/01/2008,Réglage du dérailleur avant,"dérailleur avant, réglage",First name Last name,21/01/2008,Publié,Procédure
AKB-01007,Composants,Informations de base sur le changement de vitesse et la transmission,{7a5f4e36-f0d6-4e52-baeb-2a764ac4bb3c},"<articledata><section id='0'><content><![CDATA[Les vitesses vous permettent d’ajuster la vitesse de pédalage et la résistance qu’opposent les pédales. Vous changez de vitesse en fonction des conditions extérieures (vent, côtes) et de votre propre condition physique (détendu, fatigué). Les vitesses vous permettent de grimper les côtes plus facilement. Le changement de vitesse vous permet d’adopter différentes vitesses.]]></content></section><section id='1'><content><![CDATA[<P>Le changement de vitesse comporte le levier de vitesses, les câbles, les dérailleurs, les chaînes et les pignons.</P><P>Les vélos existent en modèles à plusieurs vitesses ou une seule vitesse. Un vélo à 10 vitesses a deux pignons à l’avant et cinq sur le moyeu de la roue arrière. Les pignons sont attachés aux manivelles des pédales. Le nombre de pignons avant multiplié par le nombre de pignons arrière détermine le nombre total de vitesses du vélo. Un vélo à 24vitesses possède trois pignons avant et huit pignons arrière.</P><P>Le dérailleur commande le passage d’un pignon à un autre.</P>]]></content></section></articledata>",First name Last name,21/01/2008,,"changement de vitesse, transmission, vitesse, levier de vitesses, pignon, dérailleur",First name Last name,21/01/2008,Publié,Procédure
AKB-01047,Service,Centrage de la jante,{8a0195b7-c659-49ce-801f-2b365d32ff1a},"<articledata><section id='0'><content>Remplacement de rayons faussés ou cassés. Pour retirer un rayon, dévissez l’écrou de rayon situé à l’intérieur de la jante, puis tournez le rayon pour l’extraire du moyeu. Pour une roue sans entrelaçage radial (presque tous les VTT), vous devrez peut-être retirer DEUX rayons pour en remplacer un, parce que la tige d’un rayon peut recouvrir la tête d’un autre.</content></section></articledata>",First name Last name,21/01/2008,Centrage de la jante,centrage,First name Last name,21/01/2008,Publié,Procédure
AKB-01009,Informations générales - Vélos,Comment acheter un vélo Adventure Works de la bonne taille,{c4eb8317-f76d-4b53-9f19-2f001843c068},"<articledata><section id='0'><content><![CDATA[Cet article donne des informations sur les critères de choix de la taille d’un vélo pour un individu.]]></content></section><section id='1'><content><![CDATA[<P><B>Taille du cadre</B></P><P>Règle de base pour la taille du cadre : lorsque vous enjambez la barre, il doit y avoir un espace suffisant entre vous et la barre, selon le type de vélo considéré :</P><P><OL><LI>Vélo de route ou de tourisme— 3 à 5 cm<LI>VTT— 8 à 12 cm;10 à 12 cm pour un cycliste téméraire</LI></OL><P>La barre des VTT doit être un peu plus basse parce que vous avez tendance à stopper plus brusquement et plus fréquemment sur un sol irrégulier. Veillez lors de l’achat à porter le même type de chaussures et de tenue que lorsque vous utiliserez votre vélo.</P><P>Ceci dit, il existe bien des façons de régler votre vélo avec précision à vos besoins. Essayez-le avant de l’acheter pour vous assurer que vous pourrez le régler confortablement.</P><P></P><P><B>Hauteur/angle de la selle</B></P><P>La hauteur de selle doit être réglée pour un pédalage confortable. Vos jambes doivent être presque mais pas tout à fait tendues lorsque la pédale est en bas de course. Lorsque vous pédalez, vérifiez que vous ne penchez pas d’un côté, et que la saillie des orteils de votre pied est posée au centre de la pédale.</P><P></P><P>L’inclinaison de la selle est question de préférence personnelle. Commencez avec la selle horizontale, et utilisez votre vélo plusieurs fois. Ajustez l’inclinaison jusqu’à trouver la position la plus confortable.</P><P></P><P>La selle peut aussi se régler vers l’avant ou vers l’arrière. Lorsque la pédale est en position 3 heures, votre genou doit être à la verticale au-dessus de la pédale.</P><P></P><P><B>Hauteur du guidon</B></P><P>Le guidon s’ajuste en hauteur, en fonction de votre type de conduite et de votre confort personnel. Commencez avec un guidon environ deux centimètres plus bas que votre selle. Déplacez vos mains du guidon vers les manettes de frein, et vérifiez que vous êtes à l’aise dans les deux cas.</P><UL><LI><DIV>Pour une position plus basse et aérodynamique, ou pour du cross-country avec beaucoup de côtes, abaissez le guidon. Votre dos se fatiguera plus vite.</DIV><LI><DIV>La conduite sur route ou de tourisme est généralement plus confortable avec un guidon plus haut. Ceci vous permet de voir et d’être vu.</DIV></LI></UL>]]></content></section></articledata>",First name Last name,21/01/2008,,"taille, route, tourisme, VTT, espace, cadre, selle, hauteur, inclinaison, adaptation, guidon",First name Last name,21/01/2008,Publié,Procédure
AKB-01054,Service,Peinture d’un vélo,{28b9face-098d-4a5e-ad26-31a0a22c7cf6},"<articledata><section id='0'><content>Maintenez la bombe ou le pistolet à environ 30 cm du vélo. Si vous êtes trop près, vous ne contrôlez pas l’application - la peinture peut couler ou déborder. Trop loin, la peinture peut être sèche avant d’avoir atteint le vélo, et vous obtenez une finition à grain, et une peinture peu durable. Vous pouvez avoir besoin de vous rapprocher ou de vous éloigner, selon la peinture et le matériel utilisés. Peignez tout d’abord tous les côtés de chaque intersection et de chaque patte. Puis, l’un après l’autre, peignez entièrement chaque tube du cadre. Selon la peinture utilisée, attendez le temps prescrit entre chaque couche. Ne mélangez jamais les marques ou les qualités de peinture. Ne peignez que lorsque le temps le permet. Si la température est trop basse ou trop élevée, s’il fait trop humide ou trop de vent, vous rencontrerez toutes sortes de problèmes : insectes collés sur la peinture, peinture qui ne sèche pas, etc.</content></section></articledata>",First name Last name,21/01/2008,Peinture d’un vélo,peinture,First name Last name,21/01/2008,Brouillon,Procédure
AKB-01045,Service,Ajustement des roues à trois vitesses,{4f901107-c2cf-4e5b-9f86-32f48c4c5399},"<articledata><section id='0'><content>Maintenez le levier de vitesses exactement entre la seconde et la troisième. Tournez la connexion entre le câble et la petite chaîne jusqu’à pouvoir faire tourner les pédales vers l’avant sans tourner la roue arrière. Lorsque ce« point mort» se trouve exactement entre la troisième et la seconde, le réglage est correct. Vissez le petit écrou moleté sur la petite chaîne. Ceci doit être fait avec soin, sinon le cycliste risque de rencontrer de sérieux problèmes si le vélo se met au point mort à un moment inattendu. </content></section></articledata>",First name Last name,21/01/2008,Ajustement des roues à trois vitesses,,First name Last name,21/01/2008,Publié,Procédure
AKB-01001,Informations générales - Vélos,Réglage de la selle,{76a8d1ae-a642-4967-9daf-39c7b28030b6},"<articledata><section id='0'><content><![CDATA[La hauteur, l’angle et la position avant/arrière de la selle de votre vélo peuvent se régler.]]></content></section><section id='1'><content><![CDATA[<P>Réglage de la hauteur - lorsque la pédale est en bas de course, votre genou doit être presque tendu. La selle doit être haute, mais pas trop : si le genou est trop tendu, le cycliste est mal à l’aise.</P><P>Si votre vélo est équipé d’un levier de réglage rapide sous la selle, débloquez-le, réglez la selle dans la position voulue, et bloquez le levier. Ne dépassez pas le trait de sécurité maximum indiqué sur le tube de selle.</P><P>La selle doit être presque horizontale. Si elle penche vers l’avant, vous glisserez vers l’avant et appuierez trop sur les mains et les bras.  Cette inclinaison est question de préférence personnelle.</P><P>La selle peut se régler plus vers l’avant ou vers l’arrière.  Elle est fixée sur le tube de selle au moyen d’une paire de rails métalliques. Desserrez l’écrou et faites glisser la selle vers l’avant ou l’arrière, puis resserrez-le.</P>]]></content></section></articledata>",First name Last name,21/01/2008,,"selle, réglage, hauteur, angle, position",First name Last name,21/01/2008,Brouillon,Procédure
AKB-01029,Service,Ajustement du dérailleur avant,{92f5284f-a71b-4311-a85d-3b6548d259a9},"<articledata><section id='0'><content>En tenant fermement d’une main chaque bras de manivelle, tirez et poussez latéralement pour voir s’il y a du jeu dans le pédalier (photo). Si nécessaire, utilisez les outils de pédalier appropriés pour éliminer ce jeu. Selon votre type de pédalier, vous devrez peut-être d’abord retirer le bras de manivelle. Tout jeu dans le roulement du pédalier rend impossible l’ajustement correct du dérailleur avant. Pendant que vous travaillez sur la manivelle, vérifiez chaque boulon avec la clé hexagonale 5 mm pour vous assurer qu’ils sont bien serrés. Soulevez la chaîne hors du plus petit plateau et placez-la sur le pédalier du cadre. Tournez la manivelle à la main et regardant les plateaux par au-dessus. En prenant comme repère un côté de la cage du dérailleur avant, observez si chaque plateau tourne droit. S’ils tournent de travers, rectifiez-les en serrant doucement avec la clé à molette (réglez les mâchoires juste assez large pour glisser au-dessus du plateau). Une autre façon de procéder consiste à taper doucement sur la partie voilée avec un maillet en plastique. Ceci requiert un peu de pratique, mais c’est efficace quand vous avez pris le coup de main. Replacez la chaîne sur le plateau. Retirez ensuite la butée d’extrémité du câble, desserrez le boulon d’ancrage avec une clé, et sortez le câble de son logement (le cas échéant). Remplacez le câble s’il est rouillé ou effiloché, et le logement s’il est usé ou corrodé. Faites passer le nouveau câble dans la manette, le logement (ou le guide du dérailleur), et arrêtez-le avec le boulon d’ancrage (photo). Ne le serrez pas encore. Appliquez une huile en bombe sur les pointes des pivots de dérailleur et essuyez le surplus. Vérifiez avec un tournevis que le boulon de la cage est bien serré.</content></section></articledata>",First name Last name,21/01/2008,Ajustement du dérailleur avant,"dérailleur avant, ajustement",First name Last name,21/01/2008,Publié,Procédure
AKB-01049,Service,Remplacement des patins de freins,{5162c1ce-7dee-4052-9e2b-3d431b2b3d17},"<articledata><section id='0'><content>Retirez l’ancien patin de frein. Auparavant, notez la position de la tige sur la fente de l’étrier de frein. Notez aussi comment la fente est située parmi les entretoises de joints à rotule sur la tige du frein. (L’un des jeux d’entretoises est plus grand que l’autre. Avec l’usure du frein, les entretoises ont pu être échangées.) S’il reste une bande de roulement ou des rainures sur le patin, notez dans quel sens. Le patin de pneu se retire en dévissant l'écrou à l’extrémité de la tige filetée. Mettez le patin neuf en place, après avoir vérifié s’il y a un sens de montage. En général, si le patin comporte des V, la pointe du V est dirigée vers l’arrière du vélo. Utilisez la plus large des entretoises de joints à rotule sur le côté patin de l’étrier si vous voulez que vos étriers soient bien écartés. Si vous les préférez plus proches, placez les entretoises les plus larges du côté écrou de l’étrier.</content></section></articledata>",First name Last name,21/01/2008,Remplacement des patins de freins,patins de freins,First name Last name,21/01/2008,Publié,Procédure
AKB-01052,Service,Réglage de la hauteur du guidon,{cf96f142-95d9-421c-a5cd-3deeeb553cf5},"<articledata><section id='0'><content>Le réglage de la hauteur du guidon peut rendre le vélo plus confortable. Cela modifie aussi le comportement du vélo. Avec un guidon plus haut, il est plus facile de se redresser dans les descentes raides. Un guidon plus bas est appréciable pour monter les côtes, parce que vous pouvez plus facilement faire porter votre poids vers l’avant du vélo. La hauteur du guidon dépend de la tige, qui fixe votre guidon sur le tube de direction. Si la tige est filetée, vous pouvez aisément élever ou abaisser le guidon sans rien démonter. Si elle n’est pas filetée, vous devez démonter les pièces et soit (1) insérer des bagues sous la tige, (2) acheter et installer une tige réglable, soit (3) les deux.</content></section></articledata>",First name Last name,21/01/2008,Réglage de la hauteur du guidon,guidon,First name Last name,21/01/2008,Publié,Procédure
AKB-01021,VTT,Manuel utilisateur des VTT Adventure Works Cycle,{70f7d696-f762-4838-8faf-4630927d4842},<articledata><section id='0'><content><![CDATA[<P>Ce manuel concerne tous les modèles de VTT :</P><P>VTT-500<BR>VTT-400<BR>VTT-300<BR>VTT-200<BR>VTT-100</P>]]></content></section><section id='1'><content><![CDATA[<P>Table des matières</P><P>1. Les pièces d’un vélo</P><P>2. Géométrie et spécifications</P><P>3. Exécution d’un contrôle de sécurité </P><P>4. Entretien de votre vélo : Informations de base sur le réglage</P><BLOCKQUOTE dir=ltr style='MARGIN-RIGHT: 0px'><P>Retrait des roues avant et arrière<BR>Nettoyage et graissage</P></BLOCKQUOTE><P>5. Entretien de votre vélo : utilisateurs expérimentés</P><BLOCKQUOTE dir=ltr style='MARGIN-RIGHT: 0px'><P>Planning de maintenance<BR>Le système de freinage<BR>Vitesses et transmission<BR>Guidon et jeu de direction<BR>Suspension avant et arrière</P></BLOCKQUOTE><P>6. Revendeurs</P><P>7. Informations de garantie</P><P>8. Acrobaties<BR></P>]]></content></section></articledata>,First name Last name,21/01/2008,,"utilisateur, manuel, VTT, modèle, pièce, géométrie, spécifications, maintenance, garantie, acrobatie",First name Last name,21/01/2008,Publié,Procédure
AKB-01028,Service,Ajustement du dérailleur arrière,{bee0d260-5b8e-4108-8288-481a8d8869a3},"<articledata><section id='0'><content>Coupez l’extrémité, desserrez le boulon d’ancrage et extrayez le câble. S’il est faussé ou rouillé, remplacez-le. Graissez les sections qui passent à l’intérieur de la gaine (photo) et réintroduisez le câble dans la gaine jusqu’au boulon d’ancrage. Tournez le barillet de réglage du dérailleur dans le sens des aiguilles d’une montre, puis dévissez-le d’un tour. Ne resserrez pas encore le boulon d’ancrage. Tout en pédalant de la main droite, appuyez sur le corps du dérailleur avec le pouce gauche (photo), ce qui enclenche le grand pignon. Relâchez la pression de votre pouce pour enclencher le plus petit pignon. Recommencez plusieurs fois pour repérer une éventuelle hésitation ou un défaut de l’enclenchement. La chaîne doit se déplacer sans à-coups sur le grand et le petit pignons. Si nécessaire, ajustez la latitude de déplacement du dérailleur en tournant (photo) les vis de limites du grand et du petit braquets (en général celles du haut et du bas, respectivement) pour permettre au dérailleur de se placer avec précision sur le grand et le petit pignons. Des tours dans le sens inverse des aiguilles d’une montre permettent un déplacement plus ample ; dans l’autre sens, ils limitent le déplacement. Continuez à changer les vitesses avec votre pouce et à régler les vis jusqu’à ce que la chaîne se place parfaitement sur chaque pignon sans hésitation ni déraillement (au-delà des pignons du haut ou du bas)</content></section></articledata>",First name Last name,21/01/2008,Ajustement du dérailleur arrière,"arrière, dérailleur, ajustement",First name Last name,21/01/2008,Brouillon,Procédure
AKB-01020,Informations générales - Société,Rappels Adventure Works Cycle,{34129253-faeb-462e-ac1c-57a6380acf97},"<articledata><section id='0'><content><![CDATA[Pour votre sécurité, prenez contact avec votre revendeur si vous possédez l’un des modèles de vélo qui suivent :<BR>Si vous avez renvoyé votre carte de garantie mentionnant votre numéro de série, vous<BR>allez recevoir un courrier personnalisé vous avertissant d’un éventuel rappel s’appliquant aux<BR>produits que vous avez achetés.]]></content></section><section id='1'><content><![CDATA[<P><STRONG>Rappel de la FOURCHE DU VéLO VTT :</STRONG></P><BLOCKQUOTE dir=ltr style='MARGIN-RIGHT: 0px'><P><U>MODèLES</U>: Tous les modèles de vélos de montagne de taille de cadre 38 ou 40 pouces, et fabriqués entre novembre 2001 et décembre 2001.</P><P><U>Problème</U>: Les fourches peuvent casser et blesser gravement le cycliste.</P><P> </P></BLOCKQUOTE><P><STRONG>Rappel BRAS DE MANIVELLE :</STRONG></P><BLOCKQUOTE dir=ltr style='MARGIN-RIGHT: 0px'><P><U>MODèLES</U>: Bras de manivelle des vélos Route modèles 550-W et 350-W avec un code date compris entre juin 2000 et août 2000.</P><P><U>Problème</U>: Peuvent casser, entraînant une chute.</P></BLOCKQUOTE><P> </P><P><STRONG>Rappel FIXATION SUR TUBE DE SELLE :</STRONG></P><BLOCKQUOTE dir=ltr style='MARGIN-RIGHT: 0px'><P><U>MODèLES</U>: Le Tourisme-2000 est le seul modèle concerné. Rapportez votre vélo pour<BR>          une évaluation chez votre revendeur local.</P><P><U>Problème</U>: La fixation sur le tube de selle peut être défectueuse. Il n’est pas possible d’identifier les<BR>           fixations défectueuses.  Pour éviter une blessure possible si la fixation cédait, toutes les<BR>           fixations de selles seront remplacées par une fixation en acier inox.<BR></P></BLOCKQUOTE>]]></content></section></articledata>",First name Last name,21/01/2008,,"rappel, sécurité, garantie",First name Last name,21/01/2008,Non approuvé,Procédure
AKB-01018,Questions des revendeurs,Liste des revendeurs et conditions,{39c31bf6-b367-4cbe-b114-6104e4744f84},"<articledata><section id='0'><content><![CDATA[Liste des revendeurs et conditions]]></content></section><section id='1'><content><![CDATA[Adressez vos demandes de revendeur à :<BR>Adventure Works Cycle<BR>Bothell, WA 555-0100<BR><A href='mailto:someone@example.com'>someone@exemple.com</A>]]></content></section></articledata>",First name Last name,21/01/2008,,"revendeur, liste, conditions",First name Last name,21/01/2008,Non approuvé,Procédure
