id_tweet;text_clean
1389555541064757248;judgment launch giveaway daysw 're give away amazon voucher random entrant day
1389555538120298498;mindblow even amazon great work
1389555537864544258;judgment launch giveaway daysw 're give away amazon voucher random entrant day
1389555537105281028;second-ch heal heartsbright midnight karina hall releas may preorder co
1389555534227861506;hi guy would recommend great solar light seller amazon bought use year
1389555532206313473;judgment launch giveaway daysw 're give away amazon voucher random entrant day
1389555528695648260;jesu peter differ view christ cathol church barri l via
1389555528683171843;fabul whodunnit that pack strong charact witti dialogu cinemat set
1389555520823042050;scoop hacker broken glovo europ billion-valu amazon rivalthey sell access glovo backen
1389555519673745408;culat new shockproof hybrid case cover stand holder amazon kindl fire hd inch purpl
1389555517207498754;judgment launch giveaway daysw 're give away amazon voucher random entrant day
1389555516121223171;world war two fiona secret ca even divulg gorgeou husband go end
1389555515974246402;talk invis friend outsid one els hear u
1389555513151553539;amazon twitter account jeeesu christ tom learn clear write
1389555512509882375;book come book
1389555510647660549;powercolor red devil amd radeon rx xt game graphic c amazon checker sold
1389555508240076802;berlin razor group rais buy scale amazon marketplac merchant
1389555507044634634;dabur red past g deal resel
1389555506285584388;got amazon prime air fryer money finna talk kinda way
1389555504578539536;thought might one three mysteri amazon list day none pack
1389555503177641984;guy friend book come tomorrow call tyranni big tech josh true warrior
1389555498144264199;jual netflix premium anti blnspotifi viu appl mu
1389555497821425665;powercolor red devil amd radeon rx xt game graphic c amazon checker sold
1389555495145459712;watch say kilo moe buy song
1389555494650527745;art craftsknit
1389555493820108806;deal promot
1389555492435881986;halloween costum disguis woman disney malefic movi malefic christen black gown
1389555492146581507;elit antholog featur novel talent author live
1389555491324538881;select trade wisdom
1389555490049466370;comanch hunterth excit sequel betrayedpeco must take wound indian boy back dread llano e
1389555489470562318;hi sell anti-vaxx shirt
1389555488967254020;dellolio write beauti imageri raw honestyy imagin men walk page
1389555485322485763;live jam present call al buy
1389555485116878858;what gang go check new tree hut shea sugar review/haul
1389555484731006977;mind pay tax fact gladli discov 'm pay amazon
1389555484256968706;troubl swanki resort time go golda fairway arm hemingway hillshttp
1389555481820246019;make amazon wish list public x
1389555475524423685;amazon accept yes yes yes
1389555473389608963;judgment launch giveaway daysw 're give away amazon voucher random entrant day
1389555472764743685;icymi announc yesterday upcom releas brand new book 're worri authoritarian left de
1389555472190087170;u amazon intern best wizkid essenc feat tem peak ht
1389555471066017799;play labour love listen live buy song
1389555469820252163;cours amazon alreadi spend fortun 'd spend even accept dogecoin
1389555467047903233;vikki carr unforgett buy song
1389555466330648577;midnit u
1389555464585809923;ben ran monster ben known monster would run
1389555463902089216;amazon sale incom bn europ paid corpor tax guardian
1389555463533088771;delight scienc fiction romanc stori seri grab keep engag way thr
1389555463109361667;check book 'dragon cloud david blair author book v
1389555462560010251;pleas watch showutopiathi seri air last yearwhen vaccinethi
1389555462270488585;andr cavor heaven tune buy
1389555461678985221;gm activ day //
1389555457942081541;ebay amazon rumor tri goodluck wit
1389555456784445440;cheesemak durdsden pungent melti stori vers twist would make night shyama
1389555455563808768;take stand today build child self-esteem //
1389555454741733379;happi tuesday
1389555454662135811;amazon hire south africa includ work-from-hom job
1389555452682309634;beth unknown reason claw emma domest upheav
1389555450916458501;mafia king mafia royal novella live download today amazon
1389555450820055044;p martin drug noth stop cri
1389555446831325184;bioactiv shea kernel
1389555442666311684;wonder realli good import read partit voic untold british stori
1389555437385699329;karma aoc block amazon put new headquart would provid job
1389555435670282241;new york post surpris secret fli troubl fli see
1389555431610077194;amazon
1389555431266308099;check bk trailer spirit trilog spirit forc parity~ bks free read
1389555429387157506;releas blitz author jaimi robert take gun book take trilog amazon
1389555427864686599;white gender reveal decor set boy pink balloon
1389555427667550212;book rise ku klux klan right-w movement nation polit ht
1389555427206209536;featur magazin april //
1389555427017478150;harvest moon one world via amazon prime elig
1389555425088053253;amzn amazon paid zero european tax last year file show
1389555424077271044;day age gap emot angst brother best frien
1389555422923743235;aye amazon make loss amazon eu sarl make loss
1389555422093266950;cuisinart adjust burger press make patti garden outdoor amazon
1389555421761859586;mcaffein deep pore cleans regim r free green tea face serum mrp use code
1389555421417984001;nova pr-venda amazonateli witch hat
1389555420231094277;divers one thing focu mission make best product happ
1389555420155547653;headlin amazon revenu paid corpor taxfact corpor tax paid profit revenuestori
1389555419874476033;ft expand garden hose
1389555419660619779;releas blitz author jaimi robert take gun book take trilog amazon
1389555419132071937;via meth dark draw closer //
1389555418129600514;book spellbind seri interview reveal subject deepest darkest
1389555417689251841;whip dessert diet mix
1389555417366343685;nick enlist help sceptic dci kate garvey help hunt remorseless implac killer
1389555417198600197;dash handsom man held bowl full secret complic fall love to-d
1389555417194405888;young widow eugni face uncertain futur guernsey tragedi bring attent monsieu
1389555414543572997;amazon-shop book amazon john merrick autobiographi durham north carol
1389555414522552324;graciou warrior -- rock u buy
1389555413528551427;magu self appoint 'martian messiah convinc sick clone mar save th
1389555412614189070;stori fill curs sexual situat extrem violenc
1389555412333117440;element thrill mysteri suspens dystopian fantasi scienc fiction'th lender saga
1389555411636850693;thread latest financi result around world lt lt spoiler scale tax-dodg e
1389555407149019136;pour heart soul book reliv happiest saddest moment last ten year life
1389555406255497216;foot scrubber foot file callu remov feet-magicye pedicur tool dead skin foot scraper corn remov fo
1389555404607160320;go chapter evil big tech book sell amazon
1389555402526822403;strickland file 'll amaz perspect 'll give
1389555401369309187;mind pay tax fact gladli discov 'm pay amazon
1389555397942341638;reach frequenc plan industri wide challeng work amazon ads know 'll get reac
1389555397430759426;travel back time -- time unit love devot countri
1389555395010629633;greatest self-help bookwelcom uniqu easi understand motiv power differentget
1389555389331656706;freeform hybrids~i fell love strang sci-fi page one hollywood blueprint~
1389555388882853895;mail ru own vk russia biggest social network facebook smaller ozon biggest list retail
1389555384805990400;week wait premieresth origin stori fame villai
1389555384373837831;dettol liquid handwash ml
1389555375284838403;perfect book school edi lead prepar may th celebr differ
1389555369064665088;bought amazon year back pocket wonder 'll see find link
1389555369014448131;hi sell anti-vaxx shirt
1389555366413828105;rich get richeramazon sale incom bn europ paid corpor tax
1389555364568436738;mani way whatev meaning u serv north star twisti timescould
1389555361246552068;keep top secret lie nearli imposs sinc diagnos manic depress
1389555359581360132;break thank pandem amazon sale billion europ paid zero corpor taxi
1389555355710107650;superb biograph fictionmadam fiocca wwii novel grip tale love espionag occupi franc
1389555353969364997;new quantum messeng apollo develop soul forgiv though conclus
1389555352950251522;invis friend visit room first later lot place
1389555351297531908;judgment launch giveaway daysw 're give away amazon voucher random entrant day
1389555351016640517;reven paranorm therapist pastri che
1389555350412595204;teacher appreci week giveaway cont one winner choic simpli retweet chanc win choos
1389555349674512392;run spring theme photographi competit rais money charityfor student
1389555349523472389;royal wed collect royal central avail paperback ebook 'll find
1389555345681379331;castelbajac ragout fanni pack waist bag black jcc via amazon
1389555344171573249;jeff realli care custom
1389555342221082627;defi relic hunter sizzl blend sci-fi paranorm romanc add treasur hunt hav
1389555340052733961;see one man get close shelbi sue amazon prime
1389555338735767557;happen amazon start accept doge like bitcoinetc go hit soon
1389555338454634497;piano og ampir sjebha ft aey- ngolwe'sithathu avial tune appl music youtub spot
1389555337875927042;guy friend book come tomorrow call tyranni big tech josh true warrior
1389555337141882880;week everi week week give away amazon gift card ipad tablet nea
1389555328963026947;still think josh hawley sell anti-big tech book amazon hilari
1389555324202491909;lenovo laptop amd gb ram/ tb hdd/ win home sl/ screen year warr
1389555319991320577;amazon sale incom bn europ paid corpor tax
1389555316237365249;visit author uproar websit today author joy lilley
1389555313158758400;artifici intellig ai servic market outlook big thing happen alphab
1389555306103857152;judgment launch giveaway daysw 're give away amazon voucher random entrant day
1389555304820613123;next time wonder librari town rage council sell local park develop
1389555304715759617;hp chromebook -inch cms thin light touchscreen laptop intel ssd gb ex
1389555300852670468;amazon connect cti adapt salesforc add programm button cti action
1389555297912377346;amazon connect cti adapt salesforc add programm button cti action
1389555296713035776;book link u ca au
1389555295945375747;lenovo ideapad slim amd ryzen inch cms full hd thin light laptop hdd/window /ms
1389555295857299459;found faith fear t-shirt local rural king midwestern chainl
1389555295836323845;pleas see matter link sorri portugues help u stop deforest
1389555295286923268;judgment launch giveaway daysw 're give away amazon voucher random entrant day
1389555292765974529;yes everyday purchas
1389555287229702149;judgment launch giveaway daysw 're give away amazon voucher random entrant day
1389555286759952389;anoth great profil medic offic health dr lawrenc lohveri thank someon wi
1389555285442895873;hp notebook pc laptop home/ year warranti
1389555284331307008;amazon brand presto disinfect surface/floor cleaner l floral /- link
1389555283425386497;could save ask recommend
1389555279830740995;mad lib time use clue fill blank lucki winner score amazon vou
1389555275913334790;
1389555275485663232;hp amd athlon hd laptop /ms office/jet
1389555275091353605;icymi announc yesterday upcom releas brand new book 're worri authoritarian left de
1389555269626056709;pear shower gel shower gel
1389555269366161409;link da sua wishlist da amazon
1389555266207817728;mark free limit time mark russian sinner freegrab copi
1389555264362274816;lenovo laptop amd gb ram/ tb hdd/ win home sl/ screen year w
1389555264253308928;piano og ampir sjebha ft aey- ngolwe'sithathu avial tune appl music youtub spot
1389555263989063680;amazon sale incom bn europ paid corpor tax
1389555253025013769;bellaa rainbow wind chime
1389555252685201411;hyperx cloud core game headsetat link
1389555250131046401;link da sua wishlist da amazon
1389555245022388224;judgment launch giveaway daysw 're give away amazon voucher random entrant day
1389555244107972621;tire tire give in~rosa parksmodern mystic inner transform heal
1389555241864122371;judgment launch giveaway daysw 're give away amazon voucher random entrant day
1389555241243189250;oppl led emerg light lightweight compact size offer two-step dim multipl use case
1389555238831419398;nfl announc start thursday night footbal game exclus amazon prime although strea
1389555238588149760;premium account salehbo go netflix spotifi disney plu viu crunchyrol iwant tfc iflix youtub yousician ca
1389555237350830080;
1389555236881113089;lifelong conserv news junki 've seen liber medium done far-left alli major
1389555235945910272;focu satisfi need leav nasti thought life
1389555235807498240;call australian romanc lover avail st may kindl australia
1389555231868940290;id like pay like amazon
1389555231609008139;run blog websit look qualiti nich plr content add websit plea
1389555231202099204;link da sua wishlist da amazon
1389555230380072963;hot male dancer no-dat polici offic could go wrong fun romant comedi
1389555230103252993;jade live ring fire life dealt ring fire
1389555229679570947;extra cost receiv donat everi purchas make amazon smileyour shop hel
1389555223413264384;eureka give away two amazon canada gift card enter win
1389555223228821509;run blog websit look use sympathet nich plr content migrain f
1389555220561207296;famili dynamics-pam life richer thought possibl twist
1389555218724147200;action jack oswald man knew much take politica
1389555217235120130;guy friend book come tomorrow call tyranni big tech josh true warrior
1389555215733563404;amazon sale incom bn europ paid corpor tax
1389555215477657605;like lightheart paranorm romanc stori 'll love short delight l
1389555214710042624;took look fresh shopper use data geotyp
1389555214479511553;hi sell anti-vaxx shirt
1389555213795831814;link da sua wishlist da amazon
1389555210624847880;noth could better illustr tax system brokenhug multin corpor pay fair
1389555209958039552;amazon
1389555208552845312;heart warrior angel uniqu masterpiec stori forgiv acceptan
1389555208158552066;like premier om amazon last week may first week june offici announc
1389555204434051079;jeff bezo start amazon invest parent compani amazon valu
1389555201971998726;judgment launch giveaway daysw 're give away amazon voucher random entrant day
1389555200973844486;ad time timer inch visual timer minut kid desk countdown clock dri eras activ card also magnet
1389555199824605187;ad time timer inch visual timer minut kid desk countdown clock dri eras activ card also magneti
1389555194392768519;watch sister film mosquita mari whenev want congrat thank htt
1389555189443661824;link da sua wishlist da amazon
1389555188478980105;postal servic help deliv win amazon defeat union
1389555185874255878;incred exit announc recognis book excel award finalist book ye
1389555182246240256;good compani ride home
1389555180945829889;say emot tri hold back tear journey start finish
1389555179419226116;oh snap give away two amazon canada gift card month find enter right
1389555179385757699;morn place order said would deliv tomorrowi check order bit later
1389555175808020482;potenti tax incom amazon v reform
1389555171273891842;noth could better illustr tax system brokenhug multin corpor pay fair
1389555170728677382;link da sua wishlist da amazon
1389555170539941891;dark apocalypt worldsfantasi race magic smoth
1389555170355384323;diablo redempt joy read perfect canin partner marcu chanc hell
1389555170296668161;there afl doc amazon prime call make mark lad everyth want pro ath
1389555167348068361;acer one pentium dual core tb hdd/window home thin light laptop inch silver
1389555161790484486;cute/cr kid awesom packag handler whimsic sunday fun
1389555160368680968;judgment launch giveaway daysw 're give away amazon voucher random entrant day
1389555157097230340;handsom alpha billionair realli solut problem end major complic mi
1389555156824567809;hp thin light intel celeron laptop alexa built-in gb ram gb ssd -inch hd screen wi
1389555154945445895;save today elemi pro-collagen marin moistur essenti collect great money-off deal
1389555151023792131;lenovo ideapad slim amd ryzen fhd thin light laptop /ms
1389555150570803204;accord pay scale youd assist manag mayb make start wage targ
1389555149748817920;link da sua wishlist da amazon
1389555146611363842;'re back episod live talk michael al thing record
1389555144564555778;lenovo ideapad fhd thin light laptop gen core ssd/w
1389555142916194306;get point stori love poem hope anoth collection'th
1389555142249238530;malayalam film premier simpli south oversea may thnayattu netflix nizhal
1389555139418144768;repli peter probabl deserv wider audienc great lesser known book beatl show
1389555139338452994;east german clone file fact fiction govern tell everyth
1389555139288174593;hp thin light ryzen laptop gb ram tb hdd cms fhd screen window m offic
1389555137891475464;decemb kiss brother jay want bring back togeth
1389555134385041412;headlin amazon revenu paid corpor taxfact corpor tax paid profit revenuestori
1389555133156106240;dell inspiron cms fhd display laptop gb gb ssd integr graphic win
1389555131008569344;link da sua wishlist da amazon
1389555127191838725;glass darkli gothic vampir seri book u uk masterfu
1389555127070101509;hope everyon okay
1389555126642294785;hp th gen intel core processor -inch cm fhd laptop hdd/window /ms office/j
1389555123328794633;buy book amazon load book alreadi pc pdf load book via
1389555120610988037;thank 've beg beg ala noth liter ever
1389555108569096196;link da sua wishlist da amazon
1389555107969347584;amazon discount bts album pleas check ship sold amazon album sale
1389555104869662728;colleg textbook comprehens cover fundament concept int
1389555102709596167;im gon buy amazon return unus prime membership pay ship way mayb
1389555102453747712;jamaican check new video review
1389555100922875912;highli recommend anyon enjoy mysteri romanc adventur grab copi counterfeit daughter
1389555099626844160;hooray excit show teacher extra love week let kick thing
1389555091766657029;busi copywrit vitallearn write copi sell water fishso compil favo
1389555091116544002;amazon brand symbol men regular fit shirt deal price
1389555090986524677;josh sheppard island deathnew releas
1389555089241780232;hustler bill gate parent rich jeff bezo job got
1389555084099395591;ethereum cheaper price earn pe basi netflix amazon shopifi tesla ethereum grew reve
1389555082363117573;second chanc love antholog daniel young emma creed melissa william adina grey
1389555081700331520;judgment launch giveaway daysw 're give away amazon voucher random entrant day
1389555078957256704;judgment launch giveaway daysw 're give away amazon voucher random entrant day
1389555077510090752;hi sell anti-vaxx shirt
1389555073747927047;hello new book alert kingdom busi spiritu poetri vol joseph broadway avail
1389555068949733379;judgment launch giveaway daysw 're give away amazon voucher random entrant day
1389555063975260163;lifelong conserv news junki 've seen liber medium done far-left alli major
1389555061815193600;god romana gothic fantasi beast creatur alien vampir magic god first b
1389555061513150464;win amazon gift card click link get amazon gift card
1389555059046948871;mani left acer swift inch laptop intel pentium
1389555053783134213;ooh la la p e treat today escap dazzl citi light ep
1389555053158096904;small ceram flat ironclip extra coupon add lightn deal price
1389555050972917763;expect profit growth yeartesla shopifi amazon googl zoom netf
1389555050033389571;tax paid bntax avoid stop u get fund need healthcar public servic nee
1389555049672630272;sold amazon advertis twitter tweet iphon
1389555049404289024;link da sua wishlist da amazon
1389555048015876096;new thursday night footbal contract begin year earlier
1389555047000952834;relat work multi-fidel learn gaussian process propagat
1389555045574709249;icymi announc yesterday upcom releas brand new book 're worri authoritarian left de
1389555044039680000;friendship u listen brand-new collab
1389555040763858949;apollo raven
1389555037618192392;free book follow path discov journey free ot
1389555033117704193;link da sua wishlist da amazon
1389555031561707523;happi public day berlin zookeep utterli grip heart-break world war hist
1389555031112773636;almost mother day gift special ladi life journal purchas
1389555030781415429;love uzbekistanw hope help thank /bitcoin /amazoncom wish list
1389555030751989762;premium account salehbo go netflix spotifi disney plu viu crunchyrol iwant tfc iflix youtub yousician ca
1389555030013980677;dont miss woman fiction novel despit devil shawna jame read
1389555029191843842;amazon sale incom bn europ paid corpor tax guardian
1389555021847711746;check list wooden item okrogu les storefront
1389555020257914882;bellaa wind chime handmad home decor garden
1389555020094492676;ebook grati de terror en amazon
1389555019603709953;check dash mysteri portala sinist plot
1389555016730652675;amazon sale incom bn europ paid corpor tax guardian
1389555015811887108;busi copywrit vitallearn write copi sell water fishso compil favo
1389555015195430916;link da sua wishlist da amazon
1389555009965084680;romenza targo bikini woman piec sexi push pad adjust buckl cheeki bath suit
1389555007306059781;judgment launch giveaway daysw 're give away amazon voucher random entrant day
1389555006634872835;symact woman skinni leg
1389555005024264197;season woman cute hoodi teen girl short sleev kawaii dinosaur top casual graphic tee anim splice ho
1389555003891666949;usa stock alert amazon powercolor red devil rx xt
1389555002910420993;blow mind ran small two-man compani paid corp tax amazon that part dont miss
1389555000645455882;amazon sale incom bn europ paid corpor tax guardian
1389555000339165184;prize packag contain -month subscript amazon gift card gift card
1389554999999537159;check instant karma shine ultim mix john lennon amazon music
1389554999718449153;hollow man minut teaser //
1389554997164183557;link da sua wishlist da amazon
1389554995897409540;make like hunger game said that actual call worker compet
1389554995637493761;hi sell anti-vaxx shirt
1389554995410968579;know care effect self-car project let go
1389554994760851459;judgment launch giveaway daysw 're give away amazon voucher random entrant day
1389554992252702723;give better servic thei
1389554990528688128;nft tech showcas upcom amazon nft marketplac tech platform care design provid
1389554984056938497;judgment launch giveaway daysw 're give away amazon voucher random entrant day
1389554983721390082;come show love
1389554981821374466;accept payment yes yes yes
1389554978814050312;work home play homeher perfect headphon
1389554978671431680;triumphant radio love ree l nikki seriki feat jason nicolson-port listen
1389554978008834048;wild spirit militari life jame choos undo relationship melani
1389554977513689091;avail amazon prime
1389554974422552577;netflix amazon prime ipl fan
1389554974183526400;judgment launch giveaway daysw 're give away amazon voucher random entrant day
1389554973650735116;ceece find alien adventur solv intergalact crime fall arrog warlord arr
1389554971792785408;love mall hair maladi kristyjovolchko laugh-out-loud coming-of-ag comedi heartwarm
1389554971692216323;amazon link pleas
1389554969322430474;link da sua wishlist da amazon
1389554969037008899;check lost found spyro gyra amazon music
1389554966780579840;may margaret becom prime minist unit kingdom first longest servin
1389554964847075329;hardest thing write book sell understand subj
1389554964419252227;teeth back neck debut poetri collect co-winn new writer prize
1389554963966218240;updat shoesjust got pair shoe ive order amazonto surpris got blueto
1389554963685249025;check item etsi shop
1389554963219636225;follow happen best friend grade school take biggest
1389554958920421377;amazon thursday night footbal exclus deal begin year earli
1389554958538792962;thank ive author book publish find worthwhil read propel emin avail
1389554954105507840;meant read aloud one share heartthi collect whimsic poetri carri youinto boundl
1389554953245577222;link da sua wishlist da amazon
1389554953212006400;check book sell human surpris truth move other
1389554952914210818;berlin razor group rais buy scale amazon marketplac merchant
1389554950578053120;rewind feat wyclef jean
1389554950339014658;live fantasticradiouk runnin pharcyd entertain empow educ talk u
1389554948631842817;hi sell anti-vaxx shirt
1389554943103696904;wait ebook form pretti much giveawayi end trail hero
1389554942998949888;accept payment yes yes yes
1389554942675849216;amazon provid good servic india day deliveri hope accept port payment
1389554937542086662;lifelong conserv news junki 've seen liber medium done far-left alli major
1389554935356919817;enjoy adventure-comedi set year lord mayford expedit egypt bilingu german english
1389554933104525312;link da sua wishlist da amazon
1389554932433530882;mr juli jax hart goodread
1389554931506548739;guy friend book come tomorrow call tyranni big tech josh true warrior
1389554928113311747;amazon sale incom bn europ paid corpor tax
1389554927295422465;despit pretti obviou trump direct pentagon destroy amazon cloud govern contract r
1389554926553022464;pack king memori foam pillow -limit per account
1389554923109498881;lil yachti pardon feat futur mike made-it listen live str
1389554922929233924;thank everyon listen subscrib far 've made u number
1389554922295898114;tier diy pipe shelf -click coupon page
1389554922274922497;royal wed collect royal central avail paperback ebook 'll find
1389554921494753280;happi motiv monday motiv teach practic win
1389554919821152256;part amazon shopper panel month upload receipt still review
1389554919594680320;that annoy thing amazon prime warn whatsoev
1389554919401721859;oz bottl woman dolc gabbana perfum
