id_tweet;text_clean
1389553019751223309;judgment launch giveaway daysw 're give away amazon voucher random entrant day
1389553012130164737;like lightheart paranorm romanc stori 'll love short delight l
1389553011530293261;legaci th book seri 'the chronicl white tower actual book one trilog wit
1389553010842292226;yummier life door mat outsid entri x super absorb outdoor mat front door strongli water absorp
1389553007671627782;got fire content gym im super hype hot content drop keep
1389553006060920833;hate mediocrityh hate losingh work player longh work player hardthey love himnev afrai
1389553001547898888;death final adventureh also skeleton penchant black robe snowglob someon stolen
1389553001170354176;julswap platform strong commun achiev good goal interest investor
1389552999396167683;treat fan call nurs milli set moment
1389552993956073472;graduat banner decor balloon class larg graduat banner balloon graduat backd
1389552992341344258;pump upcom releas new book authoritarian moment pre-ord place book
1389552983285780484;want purchas kindlw paper white studi deliver locat essent
1389552981239111680;break thank pandem amazon sale billion europ paid zero corpor taxi
1389552977195806721;crochet
1389552975761321986;
1389552975614550022;automot car automot car care car accessori oil fluid tool replac part
1389552967460741125;thank cristi ur
1389552965653078017;import pre-ord album make sure count toward hanteo/gaon mani seller amazon etc claim
1389552959504195589;play deuc kraftwerk comput love kraftwerk kraftwerk comput love
1389552957214138369;tutankhamen stori share life grow rule turbul time love heartach
1389552957017006083;septemb wcf ec blind box pre order amazonu half price may worth
1389552956001984517;may margaret becom prime minist unit kingdom first longest servin
1389552954076590084;give better servic
1389552953237848065;thank contact u appreci feedback let u know need assist w
1389552951966973958;judgment launch giveaway daysw 're give away amazon voucher random entrant day
1389552949798612993;hi sell anti-vaxx shirt
1389552949471416323;book avail amazon barn nobl bam walmart avail damn near anywher
1389552946824814593;introduc cloudfront function run code edg low latenc scale
1389552946057203715;new amazon sale incom bn europ paid corpor taxvia
1389552944610164742;'gloriou terrifi experi alik recal serv humor punch line fun olden day
1389552943783981060;turnov billion europ amazon somehow post billion loss r
1389552943192543238;wan know colin jay buy son
1389552942395559937;wild ridelillian tri escap mobsh underground railroadsh one
1389552939295969280;adam look love fell lap want
1389552936779403267;need gift mother day woman love book met mani reader say could put finish
1389552932668858372;netflix amazon prime ipl fan
1389552931171536903;love back metal card load perk rebat netflix spotifi amazon prim
1389552931112882179;check dash mysteri portala sinist plot
1389552924834123778;first audiobook gone live price footballnarr author lis
1389552924313927686;amazon sale incom bn europ paid corpor tax
1389552923353522182;girl time month im think amazon knot like amazon
1389552921789050881;rohan reid song ivi tune buy
1389552921352708100;wild wick wanton rebel renegad rogu pirat
1389552920211951622;latest review book ex-fear flier made day
1389552918706200576;wonder read move fast keep interest forewarn
1389552918152450049;file amazon sale b europ made b loss therefor paid corpor tax rupe
1389552917158449153;rank day releas
1389552917129179136;return januari inspir
1389552917015891974;return march
1389552916437118979;brand new sci-fi romanc novel bestsel author reserv copi
1389552915736530946;hey detect 've hit k follow twitter thank support commemor amaz mileston
1389552915254190084;file amazon sale b europ made b loss therefor paid corpor tax rupe
1389552914432147456;new entri truth expos great reset lockdown vaccin passport new normal
1389552914398687233;hi sell anti-vaxx shirt
1389552912989401094;colleg textbook comprehens cover fundament concept int
1389552912985202690;free -page ebook pdf check top book current b
1389552911949172736;dozen amazon employe
1389552909969408006;wow second shot hit lot harder woke fever joint pain know would make feel better
1389552903057076226;honor giveaway teacher
1389552902973296642;rustic float shelf set retail
1389552902834884609;somehow find u live download today platform amazon
1389552902549774336;somehow find u live download today platform amazon
1389552901081604101;amazon-shop book amazon littl shine poetri walter e todd click link v
1389552900905570307;judgment launch giveaway daysw 're give away amazon voucher random entrant day
1389552900620394515;may th youtoday save star war toy apparel like -pack no-show sockspric
1389552900280668161;crow monster mirror hunt mental patient -- georgia prove exist breach human
1389552900054081538;tyranni promot book social mediabi show rank amazo
1389552899865317391;look fantasi novel read that full witch magic lgbtq+ fairytal charact free amazon
1389552899630448648;peopl wast night sleep rest know better
1389552899240366088;best vpn amazon prime better watch vpn trav de
1389552897998966788;thank jason paperback arriv u soon
1389552897675956228;sweet novella romanc book lover follow
1389552897390612482;amazon-shop book amazon develop self-confidenceclick url link view book
1389552897147428864;share life stori ups downsand whole shed-load supernatur experi
1389552896128077824;hi sell anti-vaxx shirt
1389552895641759747;last clonehuman becom extinct earth human clone mar connect
1389552894706339842;book kept get better bettera differ kind vampir storyd moral dilemma
1389552894446342146;find cousin stori courag ghost haunt time travel texa ranger troubl brew
1389552894152790018;clip coupon multi-us code let u know score itlimit time offerno promo
1389552894043639811;amazon seller find way stop throw away money could save thousand
1389552893733310485;judgment launch giveaway daysw 're give away amazon voucher random entrant day
1389552892219170822;'action pack good humor good length thoroughli enjoy california bound
1389552891644583936;clip coupon multi-us code let u know score itlimit time offerno pr
1389552891237654531;
1389552889929011206;breath fresh air downright fun breath kisshergoodby uk
1389552889757118465;thank author mark richardson support 'book prison pro-bono projectth sun
1389552886716243968;mermaid bear featur three woman accus witchcraft love stori
1389552883931271179;sure way make lot dollar nigeria freelanc work foreign client sell product
1389552881955745793;heart warrior angel uniqu masterpiec stori forgiv acceptan
1389552880458293254;thank nd recommend find second hand amazon 'll hunt around
1389552878633865217;avail kindl ku paperback crown princ feigh look forward easi reign
1389552878487023616;need kind nobodi know go somebodi el mind word affect
1389552876087824384;may margaret becom prime minist unit kingdom first longest servin
1389552875882258434;r amazon voucher make sure follow rule
1389552873013399552;jockey woman bra flat
1389552872723927042;cover blurb reaper rachel leigh reveal tomorrow
1389552865660788743;check work class hero take out-tak ultim mix explicit john lennon amazon music
1389552854650740746;summer bewitch uk troll k
1389552851190378497;fortnit peeli plush via amazon prime elig
1389552850745843715;walk log book walk exercis log book keep track daili
1389552850175504389;blast newest music right pretti dope xperienc radio aka
1389552849781149696;feat essenc re-ent top u amazon intern best seller
1389552849567326210;reborn reform play system
1389552847600107520;law firm big enabl authoritarian directli subcontractor greenberg traurig work fo
1389552847205933058;here poetri collect detail struggl give advic other sha
1389552846517981184;amazon wish list
1389552840448909315;expect profit growth yeartesla shopifi amazon googl zoom netf
1389552838708273155;pump upcom releas new book authoritarian moment pre-ord place book
1389552838582358016;gate close leonim rest remain lock last day offspr
1389552838444044294;republican sen mike lee rep ken buck say amazon might violat antitrust law seek jedi cloud-comp
1389552837630341120;best sell physic star war book amazon year old unreleas expand univers nove
1389552834950086659;congrat bought ps5 xbox seri x via mytrack alert ca pay follow support
1389552831468904454;pump upcom releas new book authoritarian moment pre-ord place book
1389552829283643395;microsoft cloud revenue//
1389552827324936195;like lightheart paranorm romanc stori 'll love short delight l
1389552815819853824;bought dvd amazon avoid pay subscript
1389552815555506177;pack rockstar zero low coupon page sub ampav get lowest price
1389552814817484821;mind pay tax fact gladli discov 'm pay amazon
1389552814284808192;jockey woman bra flat
1389552814183968788;netflix amazon prime ipl fan
1389552813953490948;loui dejoy strike postal servic help amazon win controversi alabama union battl
1389552811709435908;mind pay tax fact gladli discov 'm pay amazon
1389552809503305728;amazon uk stock chang stock avail seller
1389552805363453952;best sell physic star war book amazon year old unreleas expand univers nove
1389552798254129153;book would love hear thought short stori cover eclect mix theme deal wi
1389552795133546499;love christma royal white christmassecret princ small-town girl'schristma
1389552793841774593;judgment launch giveaway daysw 're give away amazon voucher random entrant day
1389552792075972613;wild ridelillian tri escap mobsh underground railroadsh
1389552791446769665;good enough peopl may get cheap stuff economi suffer destroy small busi
1389552783691554825;youv work amazon warehous anyth planet
1389552782248759300;break thank pandem amazon sale billion europ paid zero corpor taxi
1389552780461985796;hurri door matclip extra coupon add lightn deal pricework option
1389552775353176071;get next big idea improv creativ problem-solv right
1389552772618629122;get robinhood account start invest yall smoke share amazon everi six month simpl
1389552772484378634;giveaway start nd may eulog testament arriv oc
1389552770491949057;netflix amazon prime ipl fan
1389552770123018248;amazon empir like fund rebel say og coin investor join u show
1389552768654925825;p danger time call danger ladymatilda flandersth heart conquer
1389552766385786903;mai vendido amazon korean pop chao chapter freez world ver chao ch
1389552765727383555;pathet shame shoddi custom servic support ever receiv amazon india
1389552760933212164;whole fanbas whole appeal base pure femal lead show idk amazon think
1389552756231266310;ad thing amazon wishlist cheapest item nerd robe candi like want tr
1389552748224466963;curl time head sometim start golden opportun feel good head
1389552744084738059;like larg compani amazon microsoft googl made facil avail vaccin clinic
1389552742075539458;judgment launch giveaway daysw 're give away amazon voucher random entrant day
1389552739076685826;noth could better illustr tax system brokenhug multin corpor pay fair
1389552737315180545;realli hate fact jeff bezo ex wife got divorc split st
1389552728809029634;criss talk soon said cheryl listen dont speakth crystal seri classic sci-fi futurist
1389552728804839424;via reader move grace origin take japanese-american relat life
1389552719564840962;break thank pandem amazon sale billion europ paid zero corpor taxi
1389552719145447424;theme child abus violenc throughout book anyon look easi readb
1389552718713344000;god romana gothic fantasi beast creatur alien vampir magic god fi
1389552716960129024;mermaid bear featur three woman accus witchcraft love st
1389552716037464066;pee-we big adventur magnet playhous paul ruben home decor birthday gift best friend refriger
1389552715743866881;seriou interest make lot dollar freela
1389552714271629317;good
1389552707678126081;love everyon think billionair dirti word probabl -click buy thing everi month amazon
1389552704448520193;kindl bestsellerleft dead lost confus drank muchuntil last know happen
1389552699604144132;microsoft cloud revenue//
1389552694998745089;stun collect hold polit leader account appreci trium
1389552692691931136;'the purpl bird well written imagin purpl bird dylaniswritingfantasi scie
1389552691366539267;bletchley miss
1389552689307078659;buy nederland amazon site
1389552683221143556;funko mandalorian cupder
1389552682696855553;awesom softwar engin want chanc join berlin hire softwar engin
1389552682562633728;still underr -not yet-not checkout-no symbol -new retail acc
1389552681501528066;week everi week week give away amazon gift card ipad tablet nea
1389552679668658178;bum googl photo unlimit storag go away rememb june transfer p
1389552676392734724;trend propheci freialen legaci seri book
1389552676254494720;hi sell anti-vaxx shirt
1389552673872125953;via reader move grace origin take japanese-american relat
1389552671657316361;amazon show e-commerc still boom
1389552660559372290;buy gvt price like buy amazon stock bezo still work garagedont
1389552659800100864;new keurig k-select ton color stock
1389552658852286469;judgment launch giveaway daysw 're give away amazon voucher random entrant day
1389552657287847937;pack float shelf coupon plu save promo code
1389552655421296640;pack colgat toothpast cheap -coupon page
1389552652657246220;cast long shadow
1389552651633893376;yes spoken imag alarm dont like get paranoid track b
1389552650002239491;mcdonald burger burn amazon rainforest
1389552648601358346;get readi holiday avail lighten mental load ami thornton
1389552648349798400;best samsung galaxi s21 ultra screen protector world first temp
1389552647758393347;award-win summer robert fear robert paint richli textur pictur
1389552646688628744;wild megalomaniac trip american spiritu cultur revolut young southern man g
1389552646478962688;thursday night footbal move amazon exclus
1389552646000873472;seen new improv kindlepreneur book descript gener
1389552644545449986;later word hold magic powersimm modern open door invit
1389552644423880708;come eda dark character-driven trilog brutal redempt love loss inspir celtic fae mytho
1389552642951684098;piec shit still employ loui dejoy strike postal servic help amazon
1389552640162508801;thank reach u 'd like take closer look help pleas sh
1389552638988103682;milani stay put brow color pomad || link || price usd
1389552638295830530;l star smart invert frost-fre doubl door dazzl steel convert mrp
1389552638241431552;panic attack work station nearli pass l got told could take rest day
1389552638128230403;kalia alway dream babi live hous white picket fenc find soulmat
1389552638119890950;trullo area citi rome art poetri come togeth gener splendid imag
1389552637859799052;amazon prime give u show femal center straightwashedgay omg thank besti final also amazon prime http
1389552636832239620;vampir awaken game ghostth complet collect
1389552634651201541;mermaid bear featur three woman accus witchcraft love stor
1389552633266987009;happi star war day may forc may fourth
1389552633082437635;trend propheci freialen legaci seri book
1389552632088387587;judgment launch giveaway daysw 're give away amazon voucher random entrant day
1389552629731233799;cast long shadow
1389552629466939395;check actizio sweat activ funni workout woman tank top quit
1389552629014056960;everywher like amazon oh tyranni
1389552626291945475;book ring clay // rosemari //
1389552620730208259;scoop hacker broken glovo europ billion-valu amazon rivalthey sell access glovo backen
1389552620193320962;vampir awaken game ghostth complet collect
1389552619887157248;amazon sale incom bn europ paid corpor tax
1389552619849490434;look like athenian war hero set pretti good howev still tri fix hunter b
1389552616934363138;walk tour puebla cinco de mayo stori citi histori authent legend step-by-step gui
1389552615718014977;thank chanc
1389552613717331970;hot male dancer no-dat polici offic could go wrong fun romant comedi
1389552611213389824;-piec conveni kit reg clip coupon
1389552609275617282;'ve written book would happen superhero tri put end evil way fun tha
1389552606238806022;anyon tell zsjl success remind uk canada india report zsjl stre
1389552606234697728;file amazon sale b europ made b loss therefor paid corpor tax rupe
1389552594109014017;amazon boot provid test uk report via
1389552593144324097;trend book portrait success businesswoman also love letter allison famili heritag
1389552592640937984;confirm payment card deletedthi refus resolv issu
1389552591877640201;may biggest ps5 restock month ps5 stock stream live join miss
1389552590904496134;trend book portrait success businesswoman also love letter allison famili heritag
1389552588417294336;find da club club next stop
1389552584072081410;tax amazon use money give nhs staff social care worker key worker pay rise
1389552581928792068;babu say thank much wooftast parcel pet food given paw approv
1389552578678214659;amazon sale incom bn europ paid corpor tax
1389552577763635206;may margaret becom prime minist unit kingdom first longest servin
1389552576702599169;avail
1389552575003996161;five star im sci-fi hell daniel aegan want read get immers world scienc fi
1389552570935431168;bargain word read kindl month p sort
1389552570893578241;buy gvt price like buy amazon stock bezo still work garagedont
1389552570625048579;cast long shadow
1389552567198355456;darkli releas may pre-ord today platform amazon
1389552564480483329;day releas upcom collect unfortun element anatomi may eigh
1389552562521653249;fifth grade timothi bottom rule bulli seri hit market becam amazon bestsel realli out
1389552562106470405;may margaret becom prime minist unit kingdom first longest servin
1389552554888007686;seen new improv kindlepreneur book descript gener
1389552553633800198;hi guy would recommend great solar light seller amazon bought fro
1389552549213188097;saw amazon avidlov woman one piec lingeri snap crotch lace teddi sexi mini bodysuit aqua green avid
1389552543089496065;latest novel rogu kindl monthli deal may get ebook p
1389552542418309127;amazon step violat worker privaci new surveil method
1389552539180408838;break thank pandem amazon sale billion europ paid zero corpor taxi
1389552535590035461;review appreci well get uk version
1389552534415544324;hi guy would recommend great solar light seller amazon bought use year
1389552533245358088;file amazon sale b europ made b loss therefor paid corpor tax rupert neat
1389552532653969408;file amazon sale b europ made b loss therefor paid corpor tax rupert neat
1389552529902612480;free book follow path discov journey free ot
1389552522449231876;nft tech showcas upcom amazon nft marketplac tech platform care design provid
1389552520670875652;sinc 're mention let talk teamster go creat
1389552519613980674;rava intrigu mrs verstag use word minimis risk fact amazon analysi sale da
1389552517827203073;judgment launch giveaway daysw 're give away amazon voucher random entrant day
1389552516598222918;wear green mental health awar month t-shirt t-shirt wear green f via
1389552515973267458;judgment launch giveaway daysw 're give away amazon voucher random entrant day
1389552513343385601;hi guy would recommend great solar light seller amazon bought use ye
1389552509182693378;fix vtr amazon seller amazon introduc new requir maintain valid track
1389552503033892864;gm activ day //
1389552500395683840;cdc choos lifestyl includ good eat habit ampaili physic activ help maintain healthi
1389552490438295559;yummier life door mat outsid entri x super absorb outdoor mat front door strongli water absorp
1389552489997869057;netflix amazon prime ipl fan
1389552488081207297;guy friend book come tomorrow call tyranni big tech josh true warrior
1389552485841313793;financ solut e-commerc merchant multiplyingstrip clearco amazon lend money 've borrow
1389552485220638729;interview thank much vania pleasur friend sure enter giveaway end
1389552482779607042;station air play throat babi remix brs kash ft dababi citi girl
1389552481856757762;hi guy would recommend great solar light seller amazon bought use year
1389552479457714183;willa need rifl shamu need willa willa trapper sharon ryan
1389552478937567232;read anthoni sutton trilater washington learn carter set u road
1389552478564274176;judgment launch giveaway daysw 're give away amazon voucher random entrant day
1389552477373181952;mermaid bear featur three woman accus witchcraft love stori
1389552475393429507;beauti
1389552474139340804;actual happen public week love stori escapist
1389552471844995075;elit antholog featur novel talent author live
1389552470733594626;hi sell anti-vaxx shirt
1389552468816711680;'m author passion fiction
1389552466627284995;presid carter degre ladi base layer heat pant -pack alex quackiti season nugget
1389552465675276288;code work blue
1389552462932189186;amazon sale incom bn europ paid corpor tax
1389552458389544962;mozingo guitar pick
1389552456791638032;come age storyfour high school friend songwrit contestla anoth world hollywood celebriti
1389552454937849867;awesom softwar engin want chanc join berlin hire softwar engin
1389552454346358785;peter chase mothman find warn thing mothman want give himpet pa
1389552452974809097;next time wonder librari town rage council sell local park develop
1389552452861579264;robot amazon warehous what interest robot yet ba
1389552452639367168;new amazon appl
1389552451901136900;file amazon sale b europ made b loss therefor paid corpor tax rupe
1389552451339051010;seen new improv kindlepreneur book descript gener
1389552450282065926;first ever book avail amazon year want write final real thing
1389552444883996674;wild ridelillian tri escap mobsh underground railroadsh
1389552442841387013;much amazon founder jeff bezo lost divorc bill gate split wife
1389552438844272648;tommi sunshin disco fri remix rosett
1389552438613528577;marketh entrepreneuri social market platform combin strength linkedin amazon facebook
1389552432670203905;bought custom steve harvey ultra-soft fleshlight amazon get
1389552432628314118;shadow god publish north america today
1389552430938001413;limit timeebook price drop cent amazon saturday ebook marj
1389552430044651525;graet job beauti amazon princess
1389552429562220546;criss talk soon said cheryl listen dont speakth crystal seri classic sci-fi futuri
1389552429478420482;theme child abus violenc throughout book anyon look easi readb
1389552429193105417;play field gari moor phillip lynott listen live buy song
1389552428413071370;receiv million tax rebat feder govern paid zerooooo
1389552424826847236;pack rockstar zero low pageselect sub ampav get lowest price cancel
1389552422553522179;judgment launch giveaway daysw 're give away amazon voucher random entrant day
1389552422297776132;songwrit tip success learn make song great jeff benton via
1389552421362409475;want get paperback ebook new vampir novella teeth amazon custom get pre-ord
1389552419651137541;republican say might violat antitrust law seek jedi cloud-comput deal
1389552415129624587;latest novel rogu kindl monthli deal may get ebook p
1389552414257295360;matern mental health awar week pleas know alon peopl organis
1389552411040260100;reach frequenc plan industri wide challeng work amazon ads know 'll get reac
1389552408372580352;buy gvt price like buy amazon stock bezo still work garagedont
1389552407810433033;save summer shop plu icici/kotak card offer valid till th buy
1389552406648836096;sale world travel lauri woolev anthoni bourdain let see number one new york time
1389552406552354818;click full rang
1389552405231120385;yo ernest hit flee think kill father encount mentor thiev
1389552402060169217;supernatur thriller day revel avail get cop
1389552401246523392;pack rockstar zero low coupon page sub ampav get lowest
1389552400722186247;come eda dark character-driven trilog brutal redempt love loss inspir celtic f
1389552399631757315;write home seri avail paperback ebook free kindl unlimit amazon store worldwid
1389552398868393986;accus pacif coast justic seri book janic cantor
1389552396712431620;judgment launch giveaway daysw 're give away amazon voucher random entrant day
1389552394959216644;excit amazon best book month mysteri thriller suspens love bei
1389552394485260288;les paul paul intro mari jane -- rock u buy
1389552392107175937;new releas jane seymour serf belov mistress queen katherin king henri viii seek abandon wife
1389552389586313221;judgment launch giveaway daysw 're give away amazon voucher random entrant day
1389552388839776258;miss attribut employe cheryl johnson
1389552384561528833;yup walk play board game jigsaw watch seri netflix/amazon travel etc
1389552381638156289;hi folk secular creed avail free deliveri amazon prime want multipl copi ha
1389552381210288130;
1389552379490668550;judgment launch giveaway daysw 're give away amazon voucher random entrant day
1389552375887708162;embolden everi reader space make voic heard societi workplac anywher everywh
1389552375678083077;scoop hacker broken glovo europ billion-valu amazon rivalthey sell access glovo backen
1389552373182369792;amazon ipad pro -inch newest model april
1389552371446001664;amazon
1389552369906589698;amazon com discount prime program
1389552369768271874;vintag bookshop memoriespru love gin fashion anyth histori attach
1389552369445179396;tax plan wealthi
1389552365980815361;excit announc new book juli avail pre-ord authoritarian moment left weaponi
1389552363623567367;beauti week tweep kindli pls donat retweet twitter ng order are/i mean livelihood iphon
1389552361933180934;'m scientist seem arctic sea ice west antarct greenland ice sheet amazon rainfor
1389552357625712641;stori one girl determin achiev dream ya sci-fi adventur
1389552353880248324;amazon sale incom bn europ paid corpor tax
1389552353309757447;scribe sagaci wise jmiranda
1389552353297195010;five star reviewhort stori vari rudolph reindeer roman soldier modern life supernatur
