id_tweet;text_clean
1389554915505180672;book order amazon flipkart
1389554915341750278;
1389554914054098946;didnt see game thank god went lunch plan watch amazon later w
1389554912300777475;link da sua wishlist da amazon
1389554909813645314;republican say might violat antitrust law seek jedi cloud-comput deal
1389554908899184642;amazon boycot irish peopl
1389554903903789057;want revers plush bad money anyon want buy one one amazon wishli
1389554903270395911;jual netflix premium disney
1389554902360276994;adult raw fantasi read narrat exactli titl promis aftermath choicesand price u
1389554897582891008;new deal use promo code
1389554896991576064;amazon sale incom bn europ paid corpor tax
1389554896354041858;mind pay tax fact gladli discov 'm pay amazon
1389554890612088837;link da sua wishlist da amazon
1389554884538740739;europeincom billioncorpor tax tax credit govern amazon millionmeanwhil
1389554883158753280;even close bezo marri start amazon far richer gate macken
1389554879388033029;premium account salehbo go netflix spotifi disney plu viu crunchyrol iwant tfc iflix youtub yousician ca
1389554877341212672;survivor amazon ranksthi season pretti good like battl sex im happi wi
1389554876225658882;say never forget firstfal roommat terribl ideath heartbreak clair contr
1389554875810332672;blast drake money grave feat rick ross right pretti dope xperienc radio aka
1389554872727609344;new post amazon fast-dri dip powder nail kit reg
1389554872672866304;judgment launch giveaway daysw 're give away amazon voucher random entrant day
1389554872106823680;link da sua wishlist da amazon
1389554867904159749;floor lamp
1389554867128045571;noth could better illustr tax system brokenhug multin corpor pay fair
1389554865051996162;judgment launch giveaway daysw 're give away amazon voucher random entrant day
1389554864875884549;amazon sale incom bn europ paid corpor tax
1389554862443044865;bloodi disgust symbol much wrong econom polit systemamazon sa
1389554861612716034;great news 'play way avail e-book cost link
1389554859569995780;author creat vari excel cast side conflict gift characteris
1389554858299207683;lot time work gone make happen second book simpl short game avail amazon
1389554854159388676;link da sua wishlist da amazon
1389554852146028553;netflix amazon prime ipl fan
1389554849184944133;enjoy mysteri love gae-lynn wood book aveng
1389554847347875841;amazon sale incom bn europ paid corpor tax despit lockdown surg firm luxemb
1389554843975667714;hi sell anti-vaxx shirt
1389554839013761025;dark betray divid empir book brian kitchen via
1389554836618743813;link da sua wishlist da amazon
1389554833087074305;book order amazon flipkart
1389554832994971651;surpris amazon sale incom bn europ paid corpor tax
1389554828683235333;world war two fiona secret ca even divulg gorgeou husband go end
1389554825302577155;sure way make lot dollar nigeria freelanc work foreign client sell product
1389554821783511041;jeff realli care custom chase
1389554816591056898;long sort uk govern
1389554814942515201;amazon relentless campaign appal tax avoid continu
1389554813617287169;pass without comment amazon sale incom bn europ paid corpor tax
1389554813193572358;would use retweet comment
1389554812975521792;nick lim provid tech support u network white nationalist conspiraci theorist ban like ama
1389554808550481924;judgment launch giveaway daysw 're give away amazon voucher random entrant day
1389554806054920201;heart warrior angel uniqu masterpiec stori forgiv acceptan
1389554805803307008;new quantum messeng apollo develop soul forgiv though conclus
1389554805241167874;'d definit recommend fan robert ludlum
1389554797007753217;still cant fathom idea individu amazon employe pay tax compani
1389554795690737667;link da sua wishlist da amazon
1389554795380359171;anyon ever use xbox reallllli need unsur correct one get
1389554794826670087;guy friend book come tomorrow call tyranni big tech josh true warrior
1389554794474377216;let see treat worker fairli stop union bust pay tax
1389554789437124613;big girl bite back big girl releas
1389554787654553607;hit k page read ku oh yes burst thrill book continu page turner thank th
1389554787079921668;thank follow mate make sure check progress rock band gideon mob alb
1389554776040361986;winter last forev spring skip turna harem boy saga memoir young -book seri
1389554772563345410;cia call intersect feminist doesnt indict intersect femin amazon ca
1389554771812659203;nota
1389554771095220229;join submit email get amazon gift card receiv
1389554768532541443;brand new name western hero fresh locat novel
1389554768515936266;current bestsel amazon uk australia ca rain brilliant charact get bargain
1389554767236517889;got gb time got new phone thought thatll plenti annoy facebook
1389554766246682628;finish book great know hess one hitler top guy got airplan
1389554763138666500;think amazon evil empir much next person pointless articl make cross
1389554762299940864;exactli ponzi scheme textbook big con offer detail explan avail
1389554761758879751;link da sua wishlist da amazon
1389554760752238598;undocu immigr pay u tax amazon facebookit time tax rich irs
1389554757581213706;check star review annwyn blood sword sorcer saint
1389554757581164547;cto watch cloud synthet univers ai brain amazon healthcar
1389554756453126145;follow chanc win amazon exclus art seri bambi pop feel lucki pre-ord
1389554752552415235;deem plssss
1389554746441314305;headlin amazon revenu paid corpor taxfact corpor tax paid profit revenuestori
1389554745895964677;amazon day readi oooo
1389554745455611908;hadnt seen amazon boot mention togeth
1389554743232565250;amazon lego nintendo entertain system build kit
1389554740875481093;'ve read love berlin zookeep utterli grip heart-break world war histor novel
1389554740200099842;amazon bout slow hell
1389554738396598272;link da sua wishlist da amazon
1389554735791869952;matern mental health awar week pleas know alon peopl organis
1389554730993471489;premium account salehbo go netflix spotifi disney plu viu crunchyrol iwant tfc iflix youtub yousician ca
1389554726937759748;ever materi
1389554725905969157;enjoy mysteri love gae-lynn wood book aveng blood
1389554721128583174;treat fan call nurs milli set moment
1389554716191989760;tire tire give in~rosa parksmodern mystic inner transform heal
1389554708742774784;dabur red past g
1389554707421609996;file amazon sale b europ made b loss therefor paid corpor tax rupert neat
1389554705941020676;sure way make lot dollar nigeria freelanc work foreign client sell product
1389554705320353792;two favorit book seri teen author amazon absolut love
1389554704678461441;check book 'sunshin rain collect poetri soulla christodoul
1389554700396027906;india prebook vivo g start sinc april sale begin may th guess sal
1389554700291231744;amazon prime netflix ipl fan
1389554699871924226;bletchley miss
1389554698970148870;war come britain three friend loyalti test amazon
1389554697049149440;summer love nicola yeager fun romanc love
1389554695820087297;busi copywrit vitallearn write copi sell water fishso compil favo
1389554692770963459;remind birthday offer buy tomorrow ch
1389554690254385153;hi sell anti-vaxx shirt
1389554687481950208;
1389554686961668096;dabur red past g
1389554683853819905;noth could better illustr tax system brokenhug multin corpor pay fair
1389554683488964614;book blast meet heart theodor mosley meet heart black love stori
1389554683161710600;calico critter play starter furnitur set
1389554682868211718;thread everi wordif judg societi system treat le fortun free market capitali
1389554682520117249;break thank pandem amazon sale billion europ paid zero corpor taxi
1389554681182097416;sameim bout start ostrich shop amazon
1389554679626047502;etern flame bangl listen live get song
1389554668150431746;lifelong conserv news junki 've seen liber medium done far-left alli major
1389554667491840006;place order yet
1389554662563479556;judgment launch giveaway daysw 're give away amazon voucher random entrant day
1389554660260950016;amazon deal smart home von eufi
1389554659279376386;cruel saint arrang marriag mafia may sign
1389554657324830721;law firm big enabl authoritarian directli subcontractor greenberg traurig work fo
1389554655215169539;look next great read rise star first book ya seri rise fall dani truehart avail
1389554655093575681;last clonecan evil clone simon magu stop send mar second civil war
1389554654166589444;kalia alway dream babi live hous white picket fenc find soulmat
1389554654074130432;check book 'sunshin rain collect poetri soulla christodoul
1389554652862111753;amazon sale incom bn europ paid corpor tax
1389554651591319555;marx present progress fact mask process return marxism thu becam polit
1389554648160247815;eu semblanc decenc troika sent luxembourg bank shut c
1389554647891779589;featur iot technolog
1389554646314897409;excit tuesday news midsumm man sizzl romant suspens avail pr
1389554645492772870;tax paid bntax avoid stop u get fund need healthcar public servic nee
1389554644561580034;busi copywrit vitallearn write copi sell water fishso compil favo
1389554642401562635;amazon sale incom bn europ paid corpor tax big pay tax pathet
1389554642133135362;hes head los alamosi thief spi assassin know someon wait kill con
1389554638362394628;link da sua wishlist da amazon
1389554636961423360;honor giveaway teacher
1389554636546355202;noth could better illustr tax system brokenhug multin corpor pay fair
1389554628455505920;want thank youfor askedfor save bacon today nice know someon care enough help
1389554626953891840;celebr fantast gift card tyre offer chanc win one gift cardsup g
1389554625859264512;im gon buy amazon return unus prime membership pay ship way
1389554625158778886;tax amazon use money give nhs staff social care worker key worker pay rise
1389554622545678345;get concern regard amazon fire tv tri reach support team
1389554621832744962;guy friend book come tomorrow call tyranni big tech josh true warrior
1389554621023195137;detail mostli spoiler-fre review norylska groan dark portent book avail pre-ord thro
1389554619450150915;behind door caus demon spiritu warfar strategi eff
1389554618162507783;
1389554612617744386;when go come gate bezo divorc sole financi move make money increase/
1389554612496072708;k k profession small ceram flat iron woman mini inch plate nano tourmalin titanium eap heat flat iron
1389554608951861249;jia find galact adventur hord extra-terrestri kid persist askol warrior
1389554603931299843;amazon
1389554603902087172;judgment launch giveaway daysw 're give away amazon voucher random entrant day
1389554599942672390;guy friend book come tomorrow call tyranni big tech josh true warrior
1389554598180962324;serial killer coming-of-ag first-lov stori seriou mommi dearest vibe winner
1389554597254082561;amazon sale incom bn europ paid corpor tax
1389554596511633415;invis playmat child werent imaginaryth door forev
1389554592174718981;judgment launch giveaway daysw 're give away amazon voucher random entrant day
1389554592099311616;judgment launch giveaway daysw 're give away amazon voucher random entrant day
1389554591679799299;judgment launch giveaway daysw 're give away amazon voucher random entrant day
1389554590702522374;amazon ship glass hurrican lamp- envelop shove mailbox smart peopl workin
1389554590102827009;dead reckon stori johnni mitchel fighter pilot took admir yamamoto aveng pearl harb
1389554588378861568;next time wonder librari town rage council sell local park develop
1389554587703681024;stalker avail watch free tubi amazon
1389554585908523013;teacher appreci week giveaway cont one winner choic simpli retweet chanc win choos
1389554585216458778;piano og ampir sjebha ft aey- ngolwe'sithathu avial tune appl music youtub spotifi ama
1389554584318881794;hey conserv pleas go favorit left wing compani like amazon facebook leftist
1389554583807090693;royal wed collect royal central avail paperback ebook 'll find
1389554581852626949;gather storm winston churchil second world wa book today histori tol
1389554577465397250;noth could better illustr tax system brokenhug multin corpor pay fair
1389554576492167170;mad lib time use clue fill blank lucki winner score amazon vou
1389554570888634368;judgment launch giveaway daysw 're give away amazon voucher random entrant day
1389554568544014336;amazon benefit massiv pandem small busi go bust yet amazon still find way
1389554566392422401;facial mask set countadd lightn deal price promo code need
1389554565981392897;icymi announc yesterday upcom releas brand new book 're worri authoritarian left de
1389554565578563591;malayalam film premier simpli south oversea may thnayattu netflix ni
1389554563913506819;judgment launch giveaway daysw 're give away amazon voucher random entrant day
1389554562403475463;book order amazon flipkart
1389554558771335169;judgment launch giveaway daysw 're give away amazon voucher random entrant day
1389554558049955852;author care mix histor fact well-craft mytholog whole solid mystic ad
1389554557315919879;ooh la la p e treat today escap dazzl citi light ep
1389554556300845057;urgent need entitl id amazon account jio subscript pleas fix
1389554556179189760;dabur red past g mrp
1389554551800352774;amazon gener revenu advertis amazon spend market attract shopper amazon run
1389554549288050690;check star review annwyn blood sword sorcer saint
1389554548457582592;homeat core realli stori self-discoveri strength true love brilliant
1389554542686126092;mehr lockdown wagenamazon sale incom bn europ paid cor
1389554541167788035;wrap deliveri second hand amazon kindl current left would like one hit via
1389554539938947074;wrong brother friend lover romant comedi love forev alexi winter
1389554539691495430;superfici outsmart power oceana futa
1389554531550310406;free save mount rushmor andrea jo rodger //
1389554529700614147;order chicken egg amazon 'll let know
1389554529604014084;amazon u best seller save tear remix new peak
1389554528727572483;shun classic blond chef knife pakkawood handl amazon
1389554528157057031;amazon sale incom bn europ paid corpor taxdespit lockdown surg firm lux
1389554525481152513;
1389554524889784321;talk invis friend outsid one els hear u
1389554523254009856;travel etekc digit hang luggag scale
1389554520980705287;whilst local retail scotland high street struggl pandem never good
1389554517772062721;brilliant amazon arriv
1389554514869555203;link da sua wishlist da amazon
1389554513183494145;that amazon
1389554510448795651;episod big purr stream platform appl
1389554510205497346;thank lisa wing th
1389554507139350537;trend propheci freialen legaci seri book
1389554505423990784;liza rob norman discu mind market go hand hand episod mind
1389554505117802500;wordpress amazon linux reserv instanc reduc cost host everyth domain bought aws
1389554505050693632;amazon sale incom bn europ paid corpor tax
1389554504153145345;
1389554503888908291;red white boom avail
1389554499476500485;spoke nigerian univers graduat got full softwar engin offer bloomberg twosigma goldman sach e
1389554493914759179;love titl book dethron male headship woman equal but power sou
1389554491972796417;im head back offic full time today celebr buy book
1389554491368824838;judgment launch giveaway daysw 're give away amazon voucher random entrant day
1389554482908962817;judgment launch giveaway daysw 're give away amazon voucher random entrant day
1389554480857829382;
1389554477846482947;reader readi award recommend read
1389554476579803142;icymi announc yesterday upcom releas brand new book 're worri authoritarian left de
1389554476403539968;book avail amazon barn nobl bam walmart avail damn near anywher
1389554473698164747;accept payment yes yes yes
1389554473371152385;im gon make epic beginn amazon cours give away readi
1389554471139741700;amazon sale incom bn europ paid corpor tax
1389554470422401030;well sinc ask
1389554470414163973;p danger time call danger ladymatilda flandersth heart conquer
1389554465594691584;cheesemak durdsden pungent melti stori vers twist would make ni
1389554461178167297;book order amazon flipkart
1389554460943323138;review say say new author well-pres profession exa
1389554460716765184;amazon affili pro plr ebook resel plramazon affili pro plr ebook resel plr amazon affili pro plr e
1389554459399835656;may margaret becom prime minist unit kingdom first longest servin
1389554457713815553;got leave-in condition ipsi bag start run amazon ord
1389554455893315590;roll stone chartthi list count on-demand audio stream youtube/video stream platform like spotifi appl
1389554454828097536;nobi nutrit green tea fat burner green tea extract supplement egcg diet pill appetit suppress
1389554454052155392;troubl swanki resort time go golda fairway arm hemingway hill
1389554450520592391;new releas jane seymour serf belov mistress queen katherin king henri viii seek abandon wife
1389554449467781123;opinion half million dead plu
1389554448792440835;shadow god publish north america today
1389554447995609091;amazon multin compani pay virtual tax import
1389554446552678411;releas blitz author jaimi robert take gun book take trilog amazon
1389554446351339522;station air play bitch megan thee stallion click listen
1389554445445472258;book aim easi guid beginn dip toe tarotdelv tarot major arcanum
1389554445424500741;gravel road pbrownnovel take u journey time young man endur overcom hearta
1389554439384707074;dozen amazon employe
1389554432296247301;mind pay tax fact gladli discov 'm pay amazon
1389554424935161856;accept payment yes yes yes
1389554420833206292;berlin razor group rais buy scale amazon marketplac merchant
1389554419302211584;berlin razor group rais buy scale amazon marketplac merchant
1389554418199187460;peopl say best novel say wrote heart waldek boy war
1389554415204503556;hi sell anti-vaxx shirt
1389554414164267013;chang today look well-written solidli evidence-bas account
1389554413874737162;m winner other bop offici posit amazon consid bookstor
1389554410171342857;hes head los alamosi thief spi assassin know someon wait kill con
1389554409739362307;book avail amazon barn nobl bam walmart avail damn near anywher
1389554409366073344;someon pleas fix distribut new product lgs
1389554409307246607;review humor requir
1389554407730200576;current play juli lamb life lone oak radio shop
1389554406488788999;noth could better illustr tax system brokenhug multin corpor pay fair
1389554404743946241;amazonbas -pair shoe rack mrp
1389554404714553344;regist amazon regist mean still regist amazon
1389554404706062337;woe hand gave treasur hand caesarlampstand tabl bowl platter solid g
1389554404638998532;judgment launch giveaway daysw 're give away amazon voucher random entrant day
1389554404345405442;judgment launch giveaway daysw 're give away amazon voucher random entrant day
1389554402130907139;pari without memoir gregori curti
1389554401279422464;like stori compel charact book youa chang heart mackay canadi
1389554400415260676;surviv new album immort warrior
1389554399479926789;slade jackson creek seri book juli lenc great stock stuffer visit authoruproar websit
1389554394333601795;cheer literari grandmoth 'll never forget
1389554391997288451;legal right employe get access tax info pay stub cut acc
1389554390898409474;f decemb react peopl defend verbal use f b
1389554390248402948;icymi announc yesterday upcom releas brand new book 're worri authoritarian left de
1389554389921132546;gotten anoth amazon shopper decid think manag attach told
1389554384930021382;icymi announc yesterday upcom releas brand new book 're worri authoritarian left de
1389554382874857473;judgment launch giveaway daysw 're give away amazon voucher random entrant day
1389554382782537732;thought go bigger garkain award win first book uluru legaci preorder special
1389554377741029378;
1389554376813924352;india prebook vivo g start sinc april sale begin may th guess sal
1389554373953560577;like lightheart paranorm romanc stori 'll love short delight l
1389554371915042816;get amazon 've day return option like
1389554371659194370;westbrook merino wool base layer woman pant merino wool leg midweight thermal
1389554369918652419;year ago todayth nepales carri life though still twenti year ago wester
1389554365627723777;way team go help thing guy repli pleas contact w
1389554364600266756;ok either joe jill biden giant amazon jungl carter munchkin munchkin land
1389554362746351619;link da wishlist da amazon
1389554355985076229;sen mike lee rep ken buck say amazon might violat antitrust law seek jedi cloud-comput deal ultimat
1389554354592567296;first race thriller rank outsid offer check book 'rank outsid great rac
1389554352461864960;dudley sister saga foxden acr meet
1389554351589396480;bill gate immedi start date mackenzi bezo forc jeff bezo date melinda gate ash
1389554349928505349;amazon sale incom billion europ paid tax luxembourg unit handl sale
1389554348531847172;pump upcom releas new book authoritarian moment pre-ord place book
1389554348271669252;icymi brazilian presid offer conserv promis earth day global climat leader summit imm
1389554347592323073;icymi announc yesterday upcom releas brand new book 're worri authoritarian left de
1389554346568859648;
1389554343704154113;thank here latest book hope enjoy
1389554337219858437;whenev hear ppl grous 'lazi homeless peopl alway think corpor welf
1389554335969853447;judgment launch giveaway daysw 're give away amazon voucher random entrant day
1389554335298822145;lockdown ist schon toll
1389554332878708744;cheer literari grandmoth 'll never forget
1389554331985321987;berlin razor group rais buy scale amazon marketplac merchant market
1389554328227123203;need monster slayer mayb want monstersapocalypt world smother dark lig
1389554327744917505;teacher appreci week giveaway cont one winner choic simpli retweet chanc win choos
1389554326843142146;scoop hacker broken glovo europ billion-valu amazon rivalthey sell access glovo backen
1389554325723172868;judgment launch giveaway daysw 're give away amazon voucher random entrant day
1389554324255170562;noth could better illustr tax system brokenhug multin corpor pay fair
1389554323986821120;busi cant afford say leverag one busi compel partner ac
1389554323575738370;agn lockwood mysteri seriesal cozi murder mysteri set tynesidetheft murder mayhem quaysid
1389554319297482753;intuit spirit guid talk
1389554316453818369;guy friend book come tomorrow call tyranni big tech josh true warrior
1389554316046917636;free hidden danger small-town guardian book jennif pierc
1389554313354223617;-star prais good deed go unpunisheda thriller deliv punch punchit imposs put
1389554312494333952;noth could better illustr tax system brokenhug multin corpor pay fair
1389554312456638468;sell blank book online- creat account amazon kdp- design cover design interior go
1389554311680729095;book avail amazon barn nobl bam walmart avail damn near anywher
1389554309411610625;rememb amazon thing sad caus spent money could return got money back yayyy
1389554307180204033;dogecoin t-shirt dogecoin via
1389554306089721856;almost year investig amazon mexicow found shadow workforc subcontr
1389554302352494598;gm activ day //
1389554300368601090;por favor notem
1389554299504668672;hi sell anti-vaxx shirt
1389554299336904704;thought onwith angel wingsthank reader
1389554297361166337;world full obviou thing nobodi chanc ever observesclick link read aaru
1389554288343408646;woman wild woman free
1389554286862942209;might need escap government-pubic/nongovernment-priv binari republican wrote th amend
1389554283406888964;peopl get drunk night go amazon get load mid morn buy amcw
1389554278965121025;mind pay tax fact gladli discov 'm pay amazon
1389554278801584128;teacher appreci week giveaway cont one winner choic simpli retweet chanc win choos
1389554278642159621;check amazon deal tacklif shoot ear protect gun rang snr db hear protect lightweigh
1389554275110461449;break thank pandem amazon sale billion europ paid zero corpor taxi
1389554274254958592;
1389554267606953988;treat fan call nurs milli set moment
1389554267598376963;hane men pullov ecosmart fleec hood sweatshirt ash small hane
1389554267527290882;guy friend book come tomorrow call tyranni big tech josh true warrior
1389554267237781509;giveawayscool fanamazon giveaway availabledm detail
1389554264922488845;buy
1389554261449756677;im return two backless bra got amazonto whole food
1389554258853470217;would consid sign write tri get amazon add
1389554257158881285;buy sell free may
1389554256504496128;retweet want see
1389554253270769665;yktv know vibe listen onlin best mix
1389554250225623040;get ebook ankul simpli want success area meet disast everywh
1389554249122652163;lego citi space mar research shuttl reg
1389554248149618702;congrat today releas latest book anxieti work mani
1389554247801450499;noth could better illustr tax system brokenhug multin corpor pay fair
1389554246912258052;today day woman blue star avail onlin store thank interest
1389554245867905034;play dilemma listen live via asskradio buy song
1389554245565915138;copi onto devic listen without internet connect becom premiu
1389554244970172417;purpl washabl liquid school glue dri clear oz bottl -pack
1389554243988774917;sure believ amazon luxembourg oper realli lost per employe
1389554243154194433;buy storm child relat hero sassi beagl engag mysteri fascin
1389554241686093824;accur amazon refund prime servic custom live outsid ur
1389554241321250819;scoop hacker broken glovo europ billion-valu amazon rivalthey sell access glovo backen
1389554241040232452;special thank mani other particip campaign
1389554240373366786;unlik smaller busi hard-work taxpay tech giant fail pay fairli common pot common g
1389554238204882947;book avail amazon barn nobl bam walmart avail damn near anywher
1389554236120240128;
1389554230688636929;exactli dont need build without surround space infrastruct
1389554229572820992;new titl announc come blu-ray riki-oh stori ricki
