id_tweet;text_clean
1389554228360790019;chri soto pacif blue tune buy
1389554228222468103;huggi diaper
1389554223700975618;amazon prime video
1389554220265844736;stori heal forgiv oneself~ steami regenc histor read
1389554220223930372;play dream ghoo tha inspir listen tunein app sho radio buy song
1389554219468873729;mad love sean paul david guetta buy song
1389554218877571072;rockin around
1389554217145274371;solo titlesreveng demon haunt mansion sian b claven offer finer thing horror life visit page tod
1389554217136820226;contact sheet includ book check ou
1389554215685603328;come ed seriesa dark character-driven tale brutal redempt love loss
1389554214599372802;fabul plenti romant twist realli enjoy high heel beach get
1389554210778271748;right gbr play nobodi human beinz 're miss 'cuz 're play twitter tap
1389554210086207491;sex greed lie betray lust money murder reveng smoki bar seedi motel hard-drink privat eye
1389554208316137475;later word hold magic powersimm modern open door invit
1389554204868501504;may fourth your look add littl galact flare life check new echo dot sta
1389554203811536897;vampir awaken game ghostth complet collectionmt hart present mortal seri
1389554201907417095;ethereum cheaper price earn pe basi netflix amazon shopifi tesla ethereum grew reve
1389554201349529608;feat essenc re-ent top u amazon intern best seller
1389554199625670658;star war black seri luke skywalk battl simul helmet
1389554199017492484;broken promis releas u
1389554198166097920;phase jayknight jdun buy song
1389554195620052995;work home play homeher perfect headphon
1389554195380850690;huggi diaper
1389554195070660611;bought custom steve harvey ultra soft fleshlight amazon get
1389554193325862912;hello fyi new book alert kingdom busi spiritu poetri vol joseph broadway avail
1389554193325756416;good news alexa skill live uk u canada australia say alexa start artefaktor radio
1389554192507883520;amazon sale incom bn europ paid corpor tax
1389554191564169217;p secret meadow farmhous bargain warm uplift stori discov truli belo
1389554191190970371;uk amazon author page hybrid seri contain spirit trilog bks free
1389554189139947528;'an excel inform read inspir amaz easi follow
1389554189085429762;o'connor sinad three babi want got o'connor sinad
1389554188745682948;sftk ft get
1389554188733100033;may singl
1389554188703653888;one lost love enough forev thing
1389554188426809346;sen mike lee rep ken buck say amazon might violat antitrust law seek jedi cloud-comput deal
1389554188129120262;behind door caus demon spiritu warfar strategi
1389554187592208388;give away print book book
1389554186589720578;full list open box return roomba stock roomba
1389554185281155088;amd ryzen x processor mb cach ghz max boost stock amazon germani
1389554185276780544;best sale quarter ever behavior investor three year releas thank ha
1389554184207355904;distribut run includ distro-specif integrat
1389554184048062465;distribut run includ distro-specif int
1389554183339233282;play take home tonight buy song
1389554180185001989;new quantum messeng apollo develop soul forgiv though conclus
1389554179958521856;today liberti offici launch world wrote forewordi hope th
1389554179480461314;happen best friend grade school take biggest biker gang canada fol
1389554178557612036;love summer click see full rang
1389554176309465095;play kingston use somebodi buy song
1389554175432871947;one best around overal way eat healthier well rena brilliant idea
1389554174153592837;superfici outsmart power oceana futa
1389554173365080064;ebay come amazon inevit
1389554172706672646;superfici outsmart power oceana futa
1389554172341723136;mind pay tax fact gladli discov 'm pay amazon
1389554172295528453;accept payment yes yes yes
1389554171234377730;serum give valeri bout day stay faith
1389554170907275265;clean read check lynn nodima adventur clean book
1389554170550792195;mah extern batteri usb c -click coupon
1389554169669881868;superfici outsmart power oceana futa
1389554169355415556;verif videoher lil beta sissi excus end ubmit findom bds
1389554165660139528;vaclif air compressor tire inflat clip coupon use code
1389554165299531784;emma amo final live life dream david accept emma doesnt feel
1389554163995054080;men windbreak save promo code ozocf
1389554163042955266;full list open box return roomba stock
1389554162078261253;dirt devil upright bagless vacuum cleaner
1389554161855963136;distribut run includ distro-specifi
1389554161646178306;distribut run includ distro-specifi
1389554161038118912;scifi firstcontact someth everyon hard scienc fiction fan love exposit
1389554160627064832;judgment launch giveaway daysw 're give away amazon voucher random entrant day
1389554160157220866;amazon best seller-
1389554160098496550;amazon best seller
1389554159716872193;samsung galaxi review bar set famou influenc recommend whit
1389554159708303360;amazon-shop book amazon littl shine poetri walter e todd click link v
1389554159272275971;join second episod read cut first book bestsel mccabe/savag thriller
1389554159268122624;w/ couponvintag style guitar amplifi handl pu leather speaker handl guitar speaker brown
1389554159213584385;judgment arent perfect nobodi rais kid easi especi nowaday mani expectat
1389554159175847949;amazon sale incom bn europ paid corpor tax
1389554159175745545;club car kawasaki -stroke air-cool engin
1389554159163219970;detect dame cultish fish peopl flesh-eat creatur run wild night casefil arkham
1389554159033233408;alic noah bound dark strand destini intertwin life met
1389554158802554899;unbeknownst centr thousand year propheci surviv experi
1389554158668238849;laugh hope fall love charact immin enjoy imageri present stay
1389554156944437252;origin
1389554153719009281;'tens twisti spi mysteri thriller
1389554153035288579;red white boom avail
1389554152917946368;wrap deliveri second hand amazon kindl current left would like one hit via
1389554152590782464;reader readi award recommend read
1389554152481624064;wow ca believ happen without singl conserv movi produc arkansa conser
1389554152280399874;wildcat crew case find georg doom
1389554150887895047;judgment launch giveaway daysw 're give away amazon voucher random entrant day
1389554149952565253;call 'tenni fan uk enjoy amazon coverag tenni vote appreci
1389554149277192192;predict anatoliy golitsyn book still avail amazon
1389554148622880771;new book short stori novella american press thank much f
1389554148442611718;day trade journal woman trade diari trade log page trader crypto stock futur op
1389554148438331393;cold case dedic year spread page
1389554148316643332;holli jolli christma prequel holiday babi seri heartwarm realist
1389554148102877187;netflix premium hari wa/dmmurah grammarli youtub viu spot
1389554144671842307;wrap deliveri second hand amazon kindl current left would like one hit via
1389554142851436544;netflix amazon prime ipl fan
1389554142088105990;netflix amazon prime ipl fan
1389554139965927427;behind door caus demon spiritu warfar strategi e
1389554138439159814;judgment launch giveaway daysw 're give away amazon voucher random entrant day
1389554137432563712;sadira pull immort home wave song
1389554134886531077;bulk amazon uk incom book offshor luxembourg mean make
1389554132852383744;mark free limit time mark russian sinner freegrab copi
1389554128754417676;facetori collect facial mask set skin type hydrat purifi sooth moistur revitalizi
1389554128024600580;amazon warehous employe say would recommend place work accord compani survey sever
1389554123297656833;thank mate appreci amazon drive crazi kindl edit almost time expens
1389554123276644360;almost year investig amazon mexicow found shadow workforc subcontr
1389554122190462979;icymi announc yesterday upcom releas brand new book 're worri authoritarian l
1389554121259294723;thought-provok fast-pac great action suspens
1389554115626237961;pal logo resembl amazon logo bit much pal obsolet anobruh mark suckand c
1389554115114541062;busi copywrit vitallearn write copi sell water fishso compil favo
1389554114036592641;wow found fuck amazon sell print-on-demand copi older print run book wrong
1389554113059360774;book pleasur translat great stori mortal vampir thing read find
1389554107879510020;travel writer ginni left journal photo test futur heir hundr year later kayla must face danger
1389554104364589058;amazon prime exclus tnf home folk
1389554099230846979;miss one stop pay attent billion repres much amazon hide
1389554098932944897;brows ebay amazon realiz year collect figur might quit
1389554095300747274;littl taster 'you 've got cake food lover novella
1389554095128780805;matern mental health awar week pleas know alon peopl organis
1389554093023191040;trap wrong side conflict forc hide true loyaltiesshadow wall luci andrew
1389554091563524103;power posit think realli hope eureka give away two amazon
1389554090892533762;amazon sale incom bn europ paid corpor tax
1389554090607366146;curs girl rise lead warlik peopl must resist serv arriv humansh
1389554090368249863;star war galaxi adventur mando stormtroop set back amazon ht
1389554087918809089;book pleasur translat great stori mortal vampir thing read find
1389554083900518400;cent preorder preorder cent retail
1389554083653095424;none dead 'the bleak landscap beauti describ sunday time
1389554082008899589;billboard global chart rank top song base pure onlin stream digit sale worldwid
1389554081845288966;amazon best seller u save tear remix new peak
1389554081832882178;your ya fay fantasi mysteri element check empress fay mask shadow
1389554080612225030;sure look amazon would make think perfect desicc liver capsul would
1389554079177789446;great feel know pay tax amazon
1389554078674526208;noth could better illustr tax system brokenhug multin corpor pay fair
1389554071284105217;judgment launch giveaway daysw 're give away amazon voucher random entrant day
1389554070793424896;blood red rose -star 'thi author never let thoroughli enjoy read look forward read
1389554069648420864;livro por r amazon thread
1389554069556006918;avail amazon current want order
1389554068473798658;hey look descript written 'm shopifi expert
1389554066968174596;amazon hire south africa includ work-from-hom job
1389554066108211201;purpl washabl liquid school glue dri clear oz bottl -pack
1389554062560055315;judgment launch giveaway daysw 're give away amazon voucher random entrant day
1389554061465247744;singl rose garden singl friend worlda harem boy saga memoir young -book seri ht
1389554060840292360;book give feel anoth beauti addit happili ever alpha world se
1389554059623927808;book pleasur translat great stori mortal vampir thing read fin
1389554058877362178;judgment launch giveaway daysw 're give away amazon voucher random entrant day
1389554057904222208;cent preorder preorder cent retail
1389554055542890503;realli enjoy well
1389554053609295872;come ed seriesa dark character-driven tale brutal redempt love
1389554053261234178;soul rememb beauti atlanti
1389554051239534599;kiltronx livefre bedbug piec control set-queen
1389554050576826375;gate close leonim rest remain lock last day offspr first alp
1389554050044104705;netflix amazon prime ipl fan
1389554047028535305;judgment launch giveaway daysw 're give away amazon voucher random entrant day
1389554046709780484;pay zero tax might help latest corpor file luxembourg reveal
1389554046088908832;ungodli hour chrome edit chloe x hall appl music
1389554046076338203;esarora ice roller face eye puffi migrain pain relief minor injuri skin care productsgo li
1389554045698953226;guy friend book come tomorrow call tyranni big tech josh true warrior
1389554045115830274;behind door caus demon spiritu warfar strategi e
1389554037742350392;book ring clay // rosemari //
1389554035229868032;young amazon prime your watch vinland saga cold
1389554034281906177;anna love peac world begin third year quentin academi magic art scienc b
1389554031429931009;'re sorri experi look transact number inform p
1389554023867559942;judgment launch giveaway daysw 're give away amazon voucher random entrant day
1389554019530596352;everytim buy compani like- nike- amazon- starbucksspend exact amount buy stock
1389554017395744769;sale escap determin hester world chang around depen
1389554015617183744;judgment launch giveaway daysw 're give away amazon voucher random entrant day
1389554012916273156;teacher appreci week giveaway cont one winner choic simpli retweet chanc win choos
1389554010189926402;thank let u know without provid person account detail could tell u litt
1389554008000446468;mind pay tax fact gladli discov 'm pay amazon
1389554007564242945;celebr launch summer enter follow tag friend uk anyon
1389554007379746818;jeff bezo start amazon invest parent compani amazon valu
1389554006872137739;teacher appreci week giveaway cont one winner choic simpli retweet chanc win choos
1389554005706149888;new book drop today forward dr beth frate harvard medic school royalti go donati
1389554003298508807;
1389554002472456206;episod big purr stream platform appl
1389553995354673160;miiriya black woman own book store full book written black women/women color also app like amazon/
1389553994184470529;final volum catalan chronicl also avail paperback enthral read main stori en
1389553992598921218;amazon prime thriller da worth watch konjo slow ah thaa pogum end semma feel
1389553991986696203;judgment launch giveaway daysw 're give away amazon voucher random entrant day
1389553987939090433;preorder new pride funko pop -they donat portion sale
1389553987527970823;sanduguan ancient filipino ritual blood compact seal agreementth promis peac prize well
1389553985451921410;thank lali histori fantasi favorit girl return may new adventur preorder downt
1389553985313464322;giveawaysl light stripamazon giveaway availabledm detail
1389553978829070339;new releas trient press ernest roberson srapril th
1389553978447482886;kiltronx livefre bedbug piec emerg set queen
1389553978392842240;amazon shopper eh sad situat tax-dodg get overlook get even richer
1389553976815849476;buzzfe went complet shit fire half staffi havent read singl articl quiz anythi
1389553976593506309;walk tour puebla cinco de mayo stori citi histori authent legend step-by-step guid
1389553974097813505;three psycholog crime thriller plsrt
1389553970419539979;mind pay tax fact gladli discov 'm pay amazon
1389553970050383874;noth could better illustr tax system brokenhug multin corpor pay fair
1389553965856079885;mind pay tax fact gladli discov 'm pay amazon
1389553965742891008;sorri confus pal wack mole simon schuster
1389553961359773698;rise rent corpor competit threaten surviv clara best hope extens erotica collec
1389553959568920579;samsung galaxi space black gb ram gb storag
1389553956649676800;meet sebastian unforgett
1389553951054442496;murder vineyard great excus sheridan hendley amateur sleuth friend explor offer
1389553943592808456;superman give prop good day thank support polic book excel po
1389553942661578752;great stori pleasur translat planeta perdidograti en kindl unlimitedu
1389553940426067968;judgment launch giveaway daysw 're give away amazon voucher random entrant day
1389553938743975941;im gon make epic beginn amazon cours give away readi
1389553936357629953;air circul fanclip page use code checkout
1389553934163922944;bring bold eleg design work school home beauti gold geometr pattern cover
1389553933673193474;cotton kitchen multi colour apron front pocket set r
1389553932884660226;lifelong conserv news junki 've seen liber medium done far-left alli major
1389553929814433792;queen memori foam hybrid mattress
1389553929671827461;gta iv cheat app may
1389553929613107201;waaaaahh waluigi enhanc wireless control nintendo switch pre-ord amazon
1389553929357340676;superfici outsmart power oceana
1389553927406772230;updat list follow link 'll get bullshit bingo bts comeback edit card
1389553925032972289;judgment launch giveaway daysw 're give away amazon voucher random entrant day
1389553924886171649;truli convinc book stop
1389553919978790913;noth could better illustr tax system brokenhug multin corpor pay fair
1389553919366414336;your choos school kid oversea import see bigger pictur
1389553919173476355;thank lali histori fantasi favorit girl return may new adventur preord
1389553918728937476;walk tour puebla cinco de mayo stori citi histori authent legend step-by-step gui
1389553918036828162;updat yet kindli stay tune amazon prime video updat -ayaz
1389553913846698013;amazon-lik forest nurtur naturalist tendenc southern intact
1389553913787977735;amazon everyth ykj need dont need lol wed promo month f
1389553913179869186;ad air circul fanclip coupon page use code checkout
1389553912890396672;huggi diaper r
1389553911019806720;amazon music hd spotifi want hifi sound
1389553910503911426;retweet want see
1389553910029955074;'tens twisti spi mysteri thriller
1389553906687127557;queen memori foam hybrid mattress
1389553903063101441;good reliabl puls oximet link amazon pleas
1389553900823384067;new singl letter europa whiski kiss ft tomorrow may sneak peakpreord
1389553900676685824;live-fre bedbug dryer strips- dryer load
1389553899737161730;last clone sequel evolut eve//
1389553896524189701;luckyth o'sullivan brother book dark irish mafia romancebi rie warrengenr mafia romanc irish mafia
1389553890622951427;judgment launch giveaway daysw 're give away amazon voucher random entrant day
1389553890564136960;havent contact see mention cl
1389553881894596616;peopl get drunk night go amazon get load mid morn buy amcw moon
1389553878862008322;humbl proud rule cloud revenu bigger combin
1389553877025017862;serum give valeri bout day stay faith
1389553876349632514;cheer literari grandmoth 'll never forget
1389553873916923909;amazon
1389553870184009735;share microcap precipio inc specialti diagnost compani soar premarket trade tuesday ad
1389553869924020225;hi sell anti-vaxx shirt
1389553868409909251;mari l schmidt aka jackson angel flyther greater loss child
1389553867348643851;judgment launch giveaway daysw 're give away amazon voucher random entrant day
1389553867206053890;judgment launch giveaway daysw 're give away amazon voucher random entrant day
1389553866958589953;busi copywrit vitallearn write copi sell water fishso compil favo
1389553865343782913;judgment launch giveaway daysw 're give away amazon voucher random entrant day
1389553864177750016;judgment launch giveaway daysw 're give away amazon voucher random entrant day
1389553863292825606;huggi diaper
1389553855768170499;judgment launch giveaway daysw 're give away amazon voucher random entrant day
1389553854237351937;releas moonlit night bombsit viciou attackcan danc al
1389553851448053762;end wasnt expect husband girlfriend
1389553851120840705;haluuu amazon babi
1389553848142991360;judgment launch giveaway daysw 're give away amazon voucher random entrant day
1389553846490386435;'ve seen mando helmet amazon facil
1389553845173432320;humbl proud rule cloud revenu bigger combin
1389553842191323136;humbl proud rule cloud revenu bigger combin
1389553842174500872;finish convers ai platform dev great read check want
1389553837271355394;superfici outsmart power oceana f
1389553834138218497;hurri foot scrubber use promo code quantiti limit
1389553828576571395;promot twitter use iphon sold amazon stick man man
1389553827691606042;
1389553827238629378;great news new mexico
1389553826097729542;huggi diaper
1389553825036390402;midnight hour follow midnight hour left polit le
1389553821605634052;still book avail amazon especi intern custom wi
1389553821395849217;contact mani time help line noth happen sinc amazon ca deliv
1389553820301242371;amazon paid corp tax europ despit billion salesthought
1389553820183760905;
1389553820137672707;gim month imma turn amazon
1389553819508412418;tv smith lockdown holiday vinyl lp deliv dispatch sold momox co uk one lef
1389553817390395392;king soldierslisbon spi lover wwii lisbon
1389553816446504963;humbl proud rule cloud revenu bigger combin
1389553813896445955;diari celebr masseus celebr masseus chronicl
1389553813867024386;done payment fr prime twice first payment fail
1389553812231188480;wale untold black histori told south walesdocumentarystori peopl industri power film explo
1389553806065741825;amazon
1389553805549883393;judgment launch giveaway daysw 're give away amazon voucher random entrant day
1389553804681650177;finish convers ai platform dev great read check want
1389553804186722306;mind pay tax fact gladli discov 'm pay amazon
1389553802462781443;must outrag tufton street especi amazon paid tax
1389553799287693317;mind pay tax fact gladli discov 'm pay amazon
1389553797937000454;super hot deal get compar amazon
1389553796309729308;superfici outsmart power oceana futa
1389553794837479427;super hot deal get compar amazon sear ebay newegg
1389553794413826048;sweet novella romanc book lover follow http
1389553793939820557;sweet novella romanc book lover follow http
1389553793935708171;sweet novella romanc book lover follow http
1389553793617080325;amazon allow peopl exchang audibl book kindl equival start listen
1389553793356943365;page edg seat horror humor tear romanc adventur jus
1389553791922544641;new amazon sale incom bn europ paid corpor taxvia
1389553790487961603;sweet novella romanc book lover follow http
1389553790332796929;turn amazon echo dot age babi yoda male pattern bald gizmodo
1389553790282571777;start bodi mortuari stone
1389553788717993987;gethunt amazon thursday night footbal deal start earli
1389553788567101440;gift today amazon gift card
1389553788046938118;superfici outsmart power oceana f
1389553787388502016;risibl blame compani smart tax plan problem govern fiscal incompet // amaz
1389553786046193665;premium account salehbo go netflix spotifi disney plu viu crunchyrol iwant tfc iflix youtub yousician ca
1389553785480130561;door forev stori begin young age first visit spirit playmat age
1389553779226329091;judgment launch giveaway daysw 're give away amazon voucher random entrant day
1389553778790223873;waaaaahh waluigi enhanc wireless control nintendo switch pre-ord amazon
1389553778345582595;cloud help crimin justic agenc protect critic inform curiou
1389553777561284613;forkstermicro-forksalut artist song go like stone music vibe
1389553767498977291;check shade shade remast lee ritenour amazon music
1389553760611995649;mind pay tax fact gladli discov 'm pay amazon
1389553759546662915;book avail amazon barn nobl bam walmart avail damn near anywher
1389553759471214597;incred exit announc recognis book excel award finalist book ye
1389553757856301065;new feder bureau prison issu apolog reject attempt deliveri book realiti winn
1389553754366742531;version wish v version amazon
1389553751237742595;amazon sale incom bn europ paid corpor tax
1389553749144870912;buy coffe bean whole grind daili swear make huge differencew buy b
1389553746607280128;amazon sale incom bn europ paid corpor tax
1389553745630056449;amber realli live next werewolf find read neighbor werewolf
1389553743864205314;noth could better illustr tax system brokenhug multin corpor pay fair
1389553742803046402;perform gdpr complianc audit avail amazon
1389553735718686729;amazon deal gift card roundup amazon dealsplu via
1389553734959738880;long tunic top woman wear leg cotton blend tshirt overs long sleev shirt crewneck solid
1389553732199845888;reach frequenc plan industri wide challeng work amazon ads know 'll get reac
1389553730236952581;german word your proud also slightli terrifi youv fuck somebodi el degre
1389553729158979586;monster file kid friendli version x-file miller smith spend time tri prove dispr
1389553727128973313;game mass destruct -- realiti tv show twenti contest fight robot chanc
1389553726680076297;'charli angel meet jason bourn
1389553726638133249;judgment launch giveaway daysw 're give away amazon voucher random entrant day
1389553722934632451;essenti role salt bodyto learn optim salt intak check miner
1389553721474830337;sweet amazon prime add japanes subtitl movi platform learn japanes
1389553719021289473;mari l schmidt aka jackson angel flyther greater loss child
1389553715368103939;read well amazon sale incom bn europ paid corpor tax
1389553714860544001;break thank pandem amazon sale billion europ paid zero corpor taxi
1389553714277531650;let get awayto place staywher sun shine day vampir love playth dead game
1389553712738230273;blast money mu moneybagg yo foogiano hittin rmx club right pretti dope xperienc radio aka
1389553709483368451;reach frequenc plan industri wide challeng work amazon ads know 'll get reac
1389553707965108225;gm activ day //
1389553707457601538;mankind fundament understand vampir wrong presenc among u design countdown
1389553704664068096;zen art walk
1389553701736652801;judgment launch giveaway daysw 're give away amazon voucher random entrant day
1389553701702955008;english translat art book yuji kaida godzilla-rel illustr come octo
1389553700553830400;'omg addict cleverli written thriller twist turn rollercoast love find
1389553695780708365;guy friend book come tomorrow call tyranni big tech josh true warrior
1389553693880619014;remind book free everi day
1389553690764263427;amazon sale incom bn europ paid corpor tax
1389553690567053317;urgent need oxymetersomeon pleas help flipkart amazon show deliveri date may
1389553688604196867;amazon pick thursday night footbal year earli bag
1389553686091866112;avail seal honor jen talti part ladi bo press navi seal novella collect
1389553684556566538;x cloud comput x poawhi think vechain way posit next amazon googl microsoft
1389553682983919622;play call hero bite listen live buy song
1389553682799370243;go buy
1389553681964670979;magichidden agendassupernatur creaturess rivalrygood sister bad sister heart staff book
1389553680974860291;book avail amazon barn nobl bam walmart avail damn near anywher
1389553678823133189;break thank pandem amazon sale billion europ paid zero corpor taxi
